id,name_ru,slug,img,alt_ru,desc_ru,price,price_sub,order_ru,name_en,desc_en,alt_en,name_ko,desc_ko,alt_ko
1,25 розовых роз,25-rozovyh-roz,img/products/25-rozovyh-roz/1.webp,25 розовых роз Нячанг доставка,нежные розовые розы в белой упаковке — трогательный подарок на любой повод,500 000 донгов,≈ $20 · 1 600 ₽,25 розовых роз,25 pink roses,tender pink roses in white wrapping — a touching gift for any occasion,25 pink roses delivery Nha Trang,핑크 장미 25송이,하얀 포장의 부드러운 핑크 장미 — 어떤 자리에도 어울리는 선물,나트랑 핑크 장미 25송이 배달
2,25 белых роз,25-belyh-roz,img/products/25-belyh-roz/1.webp,25 белых роз Нячанг доставка,классические белые розы в белой упаковке — элегантный подарок,500 000 донгов,≈ $20 · 1 600 ₽,25 белых роз,25 white roses,classic white roses in white wrapping — an elegant and timeless gift,25 white roses delivery Nha Trang,흰 장미 25송이,하얀 포장의 클래식한 흰 장미 — 우아하고 세련된 선물,나트랑 흰 장미 25송이 배달
3,25 красных роз,25-krasnyh-roz,img/products/25-krasnyh-roz/1.webp,25 красных роз Нячанг доставка,яркие красные пионовидные розы в белой упаковке,500 000 донгов,≈ $20 · 1 600 ₽,25 красных роз,25 red roses,vibrant red garden roses in white wrapping — bold and beautiful,25 red roses delivery Nha Trang,빨간 장미 25송이,화이트 포장의 선명한 빨간 피오니 장미 — 사랑을 전하는 최고의 선물,나트랑 빨간 장미 25송이 배달
4,25 розовых пионовидных роз,25-rozovyh-pionovidnyh-roz,img/products/25-rozovyh-pionovidnyh-roz/1.webp,25 пионовидных роз Нячанг доставка,нежные пионовидные розы в белой упаковке — идеальный подарок,500 000 донгов,≈ $20 · 1 600 ₽,25 розовых пионовидных роз,25 garden pink roses,lush peony-style pink roses in white wrapping — a perfect romantic gift,25 garden pink roses Nha Trang,피오니 핑크 장미 25송이,풍성한 피오니형 핑크 장미 — 로맨틱한 선물의 완성,피오니 핑크 장미 25송이
5,7 веток лилий,7-vetok-liliy,img/products/7-vetok-liliy/1.webp,7 веток лилий Нячанг доставка,свежие белые лилии в белой упаковке — нежный и ароматный букет,600 000 донгов,≈ $24 · 1 900 ₽,7 веток лилий,7 lily stems,fresh white lilies in white wrapping — delicate and fragrant bouquet,7 lily stems delivery Nha Trang,백합 7가지,하얀 포장의 신선한 흰 백합 — 우아하고 향기로운 꽃다발,나트랑 백합 7가지 배달
6,51 белая роза с эвкалиптом,51-belaya-roza-s-evkaliptom,img/products/51-belaya-roza-s-evkaliptom/1.webp,51 белая роза с эвкалиптом Нячанг,элегантный букет белых роз с веточками эвкалипта,1 000 000 донгов,≈ $40 · 3 200 ₽,51 белая роза с эвкалиптом,51 white roses & eucalyptus,an elegant bouquet of white roses with eucalyptus sprigs,51 white roses with eucalyptus Nha Trang,흰 장미 51송이 + 유칼립투스,유칼립투스가 더해진 우아한 흰 장미 꽃다발,흰 장미 51송이 + 유칼립투스
7,51 бело-розовая роза,51-belo-rozovaya-roza,img/products/51-belo-rozovaya-roza/1.webp,51 бело-розовая роза Нячанг,пышный букет из бело-розовых роз в белой упаковке,1 000 000 донгов,≈ $40 · 3 200 ₽,51 бело-розовая роза,51 white-pink roses,a lush bouquet of white and pink roses in white wrapping,51 white-pink roses Nha Trang,흰&핑크 장미 51송이,하얀 포장의 풍성한 흰&핑크 장미 꽃다발,흰&핑크 장미 51송이
8,набор шаров S,nabor-sharov-s,img/products/nabor-sharov-s/1.webp,Набор гелиевых шаров S Нячанг,"2 большие цифры, или 1 цифра + 3 шара, или 7 фольгированных шаров",1 000 000 донгов,≈ $40 · 3 200 ₽,набор шаров S,balloon set S,"2 large number balloons, or 1 number + 3 balloons, or 7 foil balloons",Helium balloon set S Nha Trang,풍선 세트 S,"대형 숫자 2개, 또는 숫자 1개 + 풍선 3개, 또는 호일 풍선 7개",나트랑 헬륨 풍선 세트 S
9,101 роза в корзине,101-roza-v-korzine,img/products/101-roza-v-korzine/1.webp,101 роза в корзине Нячанг доставка,роскошный букет из розово-коралловых роз в корзине,2 000 000 донгов,≈ $80 · 6 300 ₽,101 роза в корзине,101 roses in a basket,a lavish arrangement of pink-coral roses in a wicker basket,101 roses in a basket Nha Trang delivery,바구니 장미 101송이,바구니에 담긴 핑크-코랄 장미 101송이 — 최고의 감동 선물,나트랑 바구니 장미 101송이 배달
10,101 бело-розовая роза в корзине,101-belo-rozovaya-roza-v-korzine,img/products/101-belo-rozovaya-roza-v-korzine/1.webp,101 бело-розовая роза в корзине Нячанг,нежные бело-розовые розы в корзине — роскошный подарок,2 000 000 донгов,≈ $80 · 6 300 ₽,101 бело-розовая роза в корзине,101 white-pink roses in a basket,tender white-pink roses in a wicker basket — a truly luxurious gift,101 white-pink roses basket Nha Trang,바구니 흰&핑크 장미 101송이,바구니에 담긴 부드러운 흰&핑크 장미 — 럭셔리 선물,바구니 흰&핑크 장미 101송이
11,набор шаров L,nabor-sharov-l,img/products/nabor-sharov-l/1.webp,Набор гелиевых шаров L Нячанг,"2 цифры + 7 шаров, или 1 цифра + 10 шаров, или 15 фольгированных шаров",2 000 000 донгов,≈ $80 · 6 300 ₽,набор шаров L,balloon set L,"2 numbers + 7 balloons, or 1 number + 10 balloons, or 15 foil balloons",Helium balloon set L Nha Trang,풍선 세트 L,"숫자 2개 + 풍선 7개, 또는 숫자 1개 + 풍선 10개, 또는 호일 풍선 15개",나트랑 헬륨 풍선 세트 L
12,151 фиолетовая роза,151-fioletovaya-roza,img/products/151-fioletovaya-roza/1.webp,151 фиолетовая роза Нячанг доставка,грандиозный букет из фиолетовых роз — максимальное впечатление,2 250 000 донгов,≈ $90 · 7 100 ₽,151 фиолетовая роза,151 purple roses,a grand bouquet of deep purple roses — maximum impression guaranteed,151 purple roses delivery Nha Trang,보라 장미 151송이,화려한 보라 장미 대형 꽃다발 — 최고의 임팩트,나트랑 보라 장미 151송이 배달
13,151 красная роза в корзине + набор шаров L,151-krasnyh-roz-korzina-i-nabor-sharov-l,img/products/151-krasnyh-roz-korzina-i-nabor-sharov-l/1.webp,151 красная роза в корзине и набор шаров L Нячанг доставка,151 красная роза в плетёной корзине плюс гелиевый набор шаров L с большими золотыми цифрами — эффектный сюрприз на юбилей,4 700 000 донгов,≈ $188 · 14 900 ₽,151 красная роза в корзине + набор шаров L,151 red roses in a basket + balloon set L,151 red roses in a woven basket plus a helium balloon set L with giant gold numbers — a stunning birthday surprise,151 red roses basket and balloon set L delivery Nha Trang,바구니에 담긴 빨간 장미 151송이 + 풍선 세트 L,바구니에 담은 빨간 장미 151송이와 대형 골드 숫자 풍선 L 세트 — 생일을 위한 화려한 서프라이즈,나트랑 빨간 장미 151송이 바구니와 풍선 세트 L 배달
14,Стильный сборный букет в белой упаковке,stilnyy-sbornyy-buket-rozovyy,img/products/stilnyy-sbornyy-buket-rozovyy/1.webp,Стильный сборный букет в белой упаковке Нячанг доставка,"стильный сборный букет из розовых и белых цветов в нежной белой упаковке — яркий и трогательный подарок на любой повод, доставим по Нячангу в день заказа",1 250 000 донгов,≈ $50 · 4 000 ₽,Стильный сборный букет в белой упаковке,Stylish mixed bouquet in white wrap,"a stylish mixed bouquet of pink and white flowers in delicate white wrapping — a bright and touching gift for any occasion, same-day delivery in Nha Trang",stylish mixed bouquet in white wrap delivery Nha Trang,화이트 포장 스타일리시 혼합 꽃다발,"하얀 포장의 핑크와 화이트 꽃으로 만든 세련된 혼합 꽃다발 — 어떤 자리에도 어울리는 화사하고 감동적인 선물, 나트랑 당일 배달",나트랑 화이트 포장 혼합 꽃다발 배달
15,Набор шаров S с 7 фольгированными цифрами,nabor-sharov-s-7-cifr,img/products/nabor-sharov-s-7-cifr/1.webp,Набор шаров S Нячанг доставка,"золотые и синие фольгированные шары, звёзды и цифры — яркий гелиевый набор S на праздник",1 000 000 донгов,≈ $40 · 3 200 ₽,Набор шаров S с 7 фольгированными цифрами,Balloon set S with 7 foil figures,"gold and blue foil balloons, stars and figures — a bright helium set S for the celebration",Balloon set S delivery Nha Trang,풍선 세트 S (호일 7개),"골드·블루 호일 풍선, 별과 숫자 — 파티를 위한 화려한 헬륨 세트 S",나트랑 풍선 세트 S 배달
16,5 веток эустомы в белой упаковке,5-vetok-eustomy-belaya-upakovka,img/products/5-vetok-eustomy-belaya-upakovka/1.webp,эустома в белой упаковке Нячанг доставка,"нежная эустома (лизиантус) в белой упаковке — пышный воздушный букет в розово-сиреневых тонах, доставим по Нячангу в день заказа",600 000 донгов,≈ $24 · 1 900 ₽,5 веток эустомы в белой упаковке,5 eustoma stems in white wrap,"delicate lisianthus (eustoma) in white wrapping — a lush, airy bouquet in pink and lilac tones, same-day delivery in Nha Trang",eustoma lisianthus bouquet in white wrap delivery Nha Trang,화이트 포장 리시안셔스 꽃다발,"하얀 포장의 부드러운 리시안셔스(유스토마) — 핑크·라일락 톤의 풍성하고 화사한 꽃다발, 나트랑 당일 배달",나트랑 리시안셔스 유스토마 꽃다발 배달
17,Набор шаров M (2 большие цифры и 3 шара),nabor-sharov-m-cifry-3-shara,img/products/nabor-sharov-m-cifry-3-shara/1.webp,Набор шаров M Нячанг доставка,две большие фольгированные цифры и 3 фигурных шара (сердце и звёзды) — яркий гелиевый набор M на день рождения и праздник,1 500 000 донгов,≈ $60 · 4 800 ₽,Набор шаров M (2 большие цифры и 3 шара),Balloon set M (2 large numbers and 3 balloons),two large foil number balloons and 3 shaped balloons (heart and stars) — a bright helium set M for birthdays and celebrations,Balloon set M delivery Nha Trang,풍선 세트 M (대형 숫자 2개 + 풍선 3개),대형 호일 숫자 풍선 2개와 모양 풍선 3개(하트·별) — 생일과 파티를 위한 화려한 헬륨 세트 M,나트랑 풍선 세트 M 배달
18,101 розовая роза в белой упаковке,101-rozovaya-roza-v-upakovke,img/products/101-rozovaya-roza-v-upakovke/1.webp,101 розовая роза в белой упаковке Нячанг доставка,"роскошный букет из 101 пионовидной розово-коралловой розы в нежной белой упаковке — эффектный подарок, доставим по Нячангу в день заказа",1 500 000 донгов,≈ $60 · 4 800 ₽,101 розовая роза в белой упаковке,101 pink roses in white wrap,"a lavish bouquet of 101 peony-style pink-coral roses in soft white wrapping — a stunning gift, same-day delivery in Nha Trang",101 pink roses in white wrap delivery Nha Trang,화이트 포장 핑크 장미 101송이,"부드러운 화이트 포장의 101송이 피오니 핑크-코랄 장미 — 화려한 감동 선물, 나트랑 당일 배달",나트랑 화이트 포장 핑크 장미 101송이 배달
19,51 розовая роза в белой упаковке,51-rozovaya-roza-v-upakovke,img/products/51-rozovaya-roza-v-upakovke/1.webp,51 розовая роза в белой упаковке Нячанг доставка,"нежный букет из 51 пионовидной розовой розы в белой упаковке — романтичный подарок, доставим по Нячангу в день заказа",1 000 000 донгов,≈ $40 · 3 200 ₽,51 розовая роза в белой упаковке,51 pink roses in white wrap,"a tender bouquet of 51 peony-style pink roses in white wrapping — a romantic gift, same-day delivery in Nha Trang",51 pink roses in white wrap delivery Nha Trang,화이트 포장 핑크 장미 51송이,"부드러운 화이트 포장의 51송이 피오니 핑크 장미 — 로맨틱한 선물, 나트랑 당일 배달",나트랑 화이트 포장 핑크 장미 51송이 배달
20,Набор шаров S (7 шаров),nabor-sharov-s-7-sharov,img/products/nabor-sharov-s-7-sharov/1.webp,Набор шаров S Нячанг доставка,"гелиевый набор S из 7 фольгированных шаров — радужный круг Happy Birthday, золотые сердце и звезда, синие звёзды и сердце, голубая звезда — яркий сюрприз на день рождения, доставим по Нячангу",1 000 000 донгов,≈ $40 · 3 200 ₽,Набор шаров S (7 шаров),Balloon set S (7 balloons),"a helium set S of 7 foil balloons — a rainbow Happy Birthday round, gold heart and star, blue stars and heart, light-blue star — a bright birthday surprise, delivered across Nha Trang",Balloon set S delivery Nha Trang,풍선 세트 S (7개),"7개 호일 풍선 헬륨 세트 S — 레인보우 Happy Birthday 라운드, 골드 하트·별, 블루 별·하트, 라이트블루 별 — 화사한 생일 서프라이즈, 나트랑 배달",나트랑 풍선 세트 S 배달
21,25 розовых роз в белой упаковке,25-rozovyh-roz-v-upakovke,img/products/25-rozovyh-roz-v-upakovke/1.webp,25 розовых роз в белой упаковке Нячанг доставка,"нежный букет из 25 розовых роз в белой упаковке — трогательный подарок на любой повод, доставим по Нячангу в день заказа",500 000 донгов,≈ $20 · 1 600 ₽,25 розовых роз в белой упаковке,25 pink roses in white wrap,"a tender bouquet of 25 pink roses in white wrapping — a touching gift for any occasion, same-day delivery in Nha Trang",25 pink roses in white wrap delivery Nha Trang,화이트 포장 핑크 장미 25송이,"부드러운 화이트 포장의 핑크 장미 25송이 — 어떤 자리에도 어울리는 선물, 나트랑 당일 배달",나트랑 화이트 포장 핑크 장미 25송이 배달
22,101 белая роза + набор шаров М,101-belaya-roza-i-nabor-sharov-m,img/products/101-belaya-roza-i-nabor-sharov-m/1.webp,101 белая роза и набор шаров М Нячанг доставка,"101 белая роза в нежной белой упаковке плюс гелиевый набор шаров М с двумя большими цифрами и фигурными шарами — эффектный сюрприз на день рождения, доставим по Нячангу в день заказа",3 000 000 донгов,≈ $120 · 9 500 ₽,101 белая роза + набор шаров М,101 white roses + balloon set M,"101 white roses in soft white wrapping plus a helium balloon set M with two large numbers and shaped balloons — a stunning birthday surprise, same-day delivery in Nha Trang",101 white roses and balloon set M delivery Nha Trang,화이트 장미 101송이 + 풍선 세트 M,"부드러운 화이트 포장의 흰 장미 101송이와 대형 숫자·모양 풍선이 있는 헬륨 풍선 세트 M — 생일을 위한 화려한 서프라이즈, 나트랑 당일 배달",나트랑 화이트 장미 101송이와 풍선 세트 M 배달
23,51 красная роза в белой упаковке и 2 букета по 25 розовых роз в белой упаковке,51-krasnaya-i-2-buketa-25-rozovyh-roz,img/products/51-krasnaya-i-2-buketa-25-rozovyh-roz/1.webp,51 красная роза и 2 букета розовых роз Нячанг доставка,"51 красная роза в белой упаковке плюс два букета по 25 розовых роз в белой упаковке — три букета одним заказом, эффектный подарок на любой повод, доставим по Нячангу в день заказа",2 000 000 донгов,≈ $80 · 6 400 ₽,51 красная роза в белой упаковке и 2 букета по 25 розовых роз в белой упаковке,51 red roses in white wrap and 2 bouquets of 25 pink roses,"51 red roses in white wrapping plus two bouquets of 25 pink roses each — three bouquets in one order, a striking gift for any occasion, same-day delivery in Nha Trang",51 red roses and 2 pink rose bouquets delivery Nha Trang,화이트 포장 레드 장미 51송이와 핑크 장미 25송이 부케 2개,"화이트 포장의 레드 장미 51송이와 핑크 장미 25송이 부케 2개 — 한 번에 세 다발, 어떤 자리에도 어울리는 화려한 선물, 나트랑 당일 배달",나트랑 레드 장미 51송이와 핑크 장미 부케 2개 배달
24,101 фиолетовая роза в фиолетовой упаковке,101-fioletovaya-roza-v-upakovke,img/products/101-fioletovaya-roza-v-upakovke/1.webp,101 фиолетовая роза в фиолетовой упаковке Нячанг доставка,"роскошный букет из 101 фиолетовой розы в фиолетовой упаковке — эффектный и необычный подарок, доставим по Нячангу в день заказа",1 500 000 донгов,≈ $60 · 4 800 ₽,101 фиолетовая роза в фиолетовой упаковке,101 purple roses in purple wrap,"a lavish bouquet of 101 purple roses in purple wrapping — a striking and unusual gift, same-day delivery in Nha Trang",101 purple roses in purple wrap delivery Nha Trang,퍼플 포장 보라 장미 101송이,"보라색 포장의 보라 장미 101송이 화려한 꽃다발 — 독특하고 인상적인 선물, 나트랑 당일 배달",나트랑 보라 장미 101송이 퍼플 포장 배달
25,51 белая роза в белой упаковке,51-belaya-roza-v-upakovke,img/products/51-belaya-roza-v-upakovke/1.webp,51 белая роза в белой упаковке Нячанг доставка,"элегантный букет из 51 белой розы в белой упаковке — классический и нежный подарок на любой повод, доставим по Нячангу в день заказа",1 000 000 донгов,≈ $40 · 3 200 ₽,51 белая роза в белой упаковке,51 white roses in white wrap,"an elegant bouquet of 51 white roses in white wrapping — a classic and tender gift for any occasion, same-day delivery in Nha Trang",51 white roses in white wrap delivery Nha Trang,화이트 포장 흰 장미 51송이,"화이트 포장의 흰 장미 51송이 우아한 꽃다발 — 어떤 자리에도 어울리는 클래식하고 부드러운 선물, 나트랑 당일 배달",나트랑 화이트 포장 흰 장미 51송이 배달
26,51 пионовидная розовая роза в белой упаковке,51-pionovidnaya-rozovaya-roza-v-upakovke,img/products/51-pionovidnaya-rozovaya-roza-v-upakovke/1.webp,51 пионовидная розовая роза в белой упаковке Нячанг доставка,"пышный букет из 51 пионовидной розовой розы в нежной белой упаковке — романтичный подарок на любой повод, доставим по Нячангу в день заказа",1 000 000 донгов,≈ $40 · 3 200 ₽,51 пионовидная розовая роза в белой упаковке,51 garden pink roses in white wrap,"a lush bouquet of 51 peony-style pink roses in soft white wrapping — a romantic gift for any occasion, same-day delivery in Nha Trang",51 garden pink roses in white wrap delivery Nha Trang,화이트 포장 피오니 핑크 장미 51송이,"부드러운 화이트 포장의 피오니형 핑크 장미 51송이 풍성한 꽃다발 — 어떤 자리에도 어울리는 로맨틱한 선물, 나트랑 당일 배달",나트랑 화이트 포장 피오니 핑크 장미 51송이 배달
27,51 фиолетовая роза в белой упаковке,51-fioletovaya-roza-v-upakovke,img/products/51-fioletovaya-roza-v-upakovke/1.webp,51 фиолетовая роза в белой упаковке Нячанг доставка,"изысканный букет из 51 фиолетовой розы в белой упаковке — редкий цвет, который сразу выделяется, эффектный подарок на годовщину или признание, доставим по Нячангу в день заказа",1 000 000 донгов,≈ $40 · 3 200 ₽,51 фиолетовая роза в белой упаковке,51 violet roses in white wrap,"a refined bouquet of 51 violet roses in white wrapping — a rare colour that stands out at once, a striking gift for an anniversary or a heartfelt confession, same-day delivery in Nha Trang",51 violet roses in white wrap delivery Nha Trang,화이트 포장 보라 장미 51송이,"화이트 포장의 보라 장미 51송이 세련된 꽃다발 — 단번에 시선을 끄는 희귀한 컬러, 기념일이나 고백을 위한 인상적인 선물, 나트랑 당일 배달",나트랑 화이트 포장 보라 장미 51송이 배달
28,Яркий набор S (7 фольгированных шаров),yarkiy-nabor-sharov-s,img/products/yarkiy-nabor-sharov-s/1.webp,Яркий набор S 7 фольгированных шаров Нячанг доставка,"яркий набор из 7 фольгированных шаров — звёзды, сердца и круг Happy Birthday в гелии, готовая фотозона на день рождения, доставим по Нячангу в день заказа",1 000 000 донгов,≈ $40 · 3 200 ₽,Яркий набор S (7 фольгированных шаров),Bright balloon set S (7 foil balloons),"a bright set of 7 foil balloons — stars, hearts and a Happy Birthday round in helium, a ready-made photo zone for a birthday, same-day delivery in Nha Trang",Bright balloon set S 7 foil balloons delivery Nha Trang,화사한 풍선 세트 S (호일 풍선 7개),"별·하트·Happy Birthday 원형으로 구성된 7개의 호일 풍선 화사한 세트 — 생일 포토존을 완성하는 헬륨 풍선, 나트랑 당일 배달",나트랑 호일 풍선 세트 S 7개 배달
29,101 розовая роза в корзине с буквой «К»,101-rozovyh-roz-korzina-bukva-k,img/products/101-rozovyh-roz-korzina-bukva-k/1.webp,101 розовая роза в корзине с буквой К Нячанг доставка,101 розовая роза в корзине с буквой «К» из белых роз в центре — эффектный именной подарок,2 500 000 донгов,≈ $100 · 8 000 ₽,101 розовая роза в корзине с буквой «К»,101 pink roses in a basket with letter K,a basket of 101 pink roses with the letter K of white roses in the centre — a striking personalised gift,101 pink roses basket letter K Nha Trang delivery,바구니 핑크 장미 101송이 — 흰 장미 K,가운데 흰 장미로 만든 K가 있는 바구니 핑크 장미 101송이 — 특별한 맞춤 선물,나트랑 바구니 핑크 장미 101송이 K 배달
