id,name_ru,slug,img,alt_ru,desc_ru,price,price_sub,order_ru,name_en,desc_en,alt_en,name_ko,desc_ko,alt_ko
30,51 коралловая роза в белой упаковке,51-korallovaya-roza-v-upakovke,img/products/51-korallovaya-roza-v-upakovke/1.webp,51 коралловая роза в белой упаковке Нячанг доставка,"нежный букет из 51 коралловой розы в белой упаковке — тёплый персиково-коралловый оттенок, эффектный подарок на любой повод, доставим по Нячангу в день заказа",1 000 000 донгов,≈ $40 · 3 200 ₽,51 коралловая роза в белой упаковке,51 coral roses in white wrap,"a tender bouquet of 51 coral roses in white wrapping — a warm peach-coral shade, a striking gift for any occasion, same-day delivery in Nha Trang",51 coral roses in white wrap Nha Trang delivery,화이트 포장 코랄 장미 51송이,"화이트 포장의 코랄 장미 51송이 부드러운 꽃다발 — 따뜻한 피치-코랄 색감, 어떤 자리에도 어울리는 화려한 선물, 나트랑 당일 배달",나트랑 화이트 포장 코랄 장미 51송이 배달
31,Нежный сборный букет в белой упаковке,nezhnyy-sbornyy-buket-v-upakovke,img/products/nezhnyy-sbornyy-buket-v-upakovke/1.webp,Нежный сборный букет в белой упаковке Нячанг доставка,"нежный сборный букет из розовых и белых цветов в белой упаковке — пионовидные розы, эустома и зелень, трогательный подарок на любой повод, доставим по Нячангу в день заказа",1 250 000 донгов,≈ $50 · 4 000 ₽,Нежный сборный букет в белой упаковке,Tender mixed bouquet in white wrap,"a tender mixed bouquet of pink and white flowers in white wrapping — peony roses, eustoma and greenery, a touching gift for any occasion, same-day delivery in Nha Trang",tender mixed bouquet in white wrap delivery Nha Trang,화이트 포장 부드러운 혼합 꽃다발,"화이트 포장의 핑크와 화이트 꽃으로 만든 부드러운 혼합 꽃다발 — 피오니 장미, 리시안셔스, 그린 — 어떤 자리에도 어울리는 감동적인 선물, 나트랑 당일 배달",나트랑 화이트 포장 부드러운 혼합 꽃다발 배달
32,Красно-бежевый набор S (7 фольгированных шаров),krasno-bezhevyy-nabor-sharov-s,img/products/krasno-bezhevyy-nabor-sharov-s/1.webp,Красно-бежевый набор S 7 фольгированных шаров Нячанг доставка,"красно-бежевый набор из 7 фольгированных шаров — красные сердца и бежевые шары в гелии, готовая фотозона на романтический праздник, доставим по Нячангу в день заказа",1 000 000 донгов,≈ $40 · 3 200 ₽,Красно-бежевый набор S (7 фольгированных шаров),Red & beige balloon set S (7 foil balloons),"a red and beige set of 7 foil balloons — red hearts and beige balloons in helium, a ready-made photo zone for a romantic celebration, same-day delivery in Nha Trang",Red and beige balloon set S 7 foil balloons delivery Nha Trang,레드-베이지 풍선 세트 S (호일 풍선 7개),"레드 하트와 베이지 풍선으로 구성된 7개의 호일 풍선 레드-베이지 세트 — 로맨틱한 기념일 포토존을 완성하는 헬륨 풍선, 나트랑 당일 배달",나트랑 레드-베이지 호일 풍선 세트 S 7개 배달
33,101 красная роза в белой упаковке,101-krasnaya-roza-v-upakovke,img/products/101-krasnaya-roza-v-upakovke/1.webp,101 красная роза в белой упаковке Нячанг доставка,"роскошный букет из 101 красной розы в белой упаковке — классический и яркий подарок, доставим по Нячангу в день заказа",1 500 000 донгов,≈ $60 · 4 800 ₽,101 красная роза в белой упаковке,101 red roses in white wrap,"a lavish bouquet of 101 red roses in white wrapping — a classic and vibrant gift, same-day delivery in Nha Trang",101 red roses in white wrap delivery Nha Trang,화이트 포장 레드 장미 101송이,"화이트 포장의 레드 장미 101송이 화려한 꽃다발 — 클래식하고 강렬한 선물, 나트랑 당일 배달",나트랑 레드 장미 101송이 화이트 포장 배달
34,Нежный розовый сборный букет в белой упаковке,nezhnyy-rozovyy-sbornyy-buket-v-upakovke,img/products/nezhnyy-rozovyy-sbornyy-buket-v-upakovke/1.webp,Нежный розовый сборный букет в белой упаковке Нячанг доставка,"нежный розовый сборный букет из пионовидных роз и сезонных цветов в белой упаковке — романтичный подарок на любой повод, доставим по Нячангу в день заказа",1 250 000 донгов,≈ $50 · 4 000 ₽,Нежный розовый сборный букет в белой упаковке,Tender pink mixed bouquet in white wrap,"a tender pink mixed bouquet of peony roses and seasonal flowers in white wrapping — a romantic gift for any occasion, same-day delivery in Nha Trang",Tender pink mixed bouquet in white wrap delivery Nha Trang,화이트 포장 부드러운 핑크 혼합 꽃다발,"화이트 포장의 피오니 장미와 제철 꽃으로 만든 부드러운 핑크 혼합 꽃다발 — 어떤 자리에도 어울리는 로맨틱한 선물, 나트랑 당일 배달",나트랑 화이트 포장 부드러운 핑크 혼합 꽃다발 배달
35,151 красная роза + набор шаров M (10 сердец),151-krasnaya-roza-i-nabor-sharov-m,img/products/151-krasnaya-roza-i-nabor-sharov-m/1.webp,151 красная роза и набор шаров M Нячанг доставка,"151 красная роза в белой упаковке плюс гелиевый набор шаров M из 10 красных фольгированных сердец — эффектный романтический сюрприз, доставим по Нячангу в день заказа",3 750 000 донгов,≈ $150 · 12 000 ₽,151 красная роза + набор шаров M (10 сердец),151 red roses + balloon set M (10 hearts),"151 red roses in white wrapping plus a helium balloon set M of 10 red foil hearts — a striking romantic surprise, same-day delivery in Nha Trang",151 red roses and balloon set M delivery Nha Trang,레드 장미 151송이 + 풍선 세트 M (하트 10개),"화이트 포장의 레드 장미 151송이와 빨간 호일 하트 10개로 구성된 헬륨 풍선 세트 M — 인상적인 로맨틱 서프라이즈, 나트랑 당일 배달",나트랑 레드 장미 151송이와 풍선 세트 M 배달
36,Набор шаров S + 25 розовых роз в белой упаковке,25-rozovyh-roz-i-nabor-sharov-s,img/products/25-rozovyh-roz-i-nabor-sharov-s/1.webp,Набор шаров S и 25 розовых роз Нячанг доставка,"гелиевый набор шаров S и 25 розовых роз в белой упаковке — нежный праздничный комплект с фотозоной, доставим по Нячангу в день заказа",1 500 000 донгов,≈ $60 · 4 800 ₽,Набор шаров S + 25 розовых роз в белой упаковке,Balloon set S + 25 pink roses in white wrap,"a helium balloon set S and 25 pink roses in white wrapping — a tender festive combo with a photo zone, same-day delivery in Nha Trang",Balloon set S and 25 pink roses delivery Nha Trang,풍선 세트 S + 핑크 장미 25송이 (화이트 포장),"헬륨 풍선 세트 S와 화이트 포장의 핑크 장미 25송이 — 포토존이 있는 부드러운 기념일 세트, 나트랑 당일 배달",나트랑 풍선 세트 S와 핑크 장미 25송이 배달
37,51 нежно-розовая роза в белой упаковке,51-nezhno-rozovaya-roza-v-upakovke,img/products/51-nezhno-rozovaya-roza-v-upakovke/1.webp,51 нежно-розовая роза в белой упаковке Нячанг доставка,"нежный букет из 51 нежно-розовой розы в белой упаковке — трогательный подарок на любой повод, доставим по Нячангу в день заказа",1 000 000 донгов,≈ $40 · 3 200 ₽,51 нежно-розовая роза в белой упаковке,51 soft pink roses in white wrap,"a tender bouquet of 51 soft pink roses in white wrapping — a touching gift for any occasion, same-day delivery in Nha Trang",51 soft pink roses in white wrap delivery Nha Trang,화이트 포장 연핑크 장미 51송이,"부드러운 화이트 포장의 연핑크 장미 51송이 꽃다발 — 어떤 자리에도 어울리는 감동적인 선물, 나트랑 당일 배달",나트랑 화이트 포장 연핑크 장미 51송이 배달
38,Бежево-серебряный набор S (7 фольгированных шаров),bezhevo-serebryanyy-nabor-sharov-s,img/products/bezhevo-serebryanyy-nabor-sharov-s/1.webp,Бежево-серебряный набор S 7 фольгированных шаров Нячанг доставка,"бежево-серебряный набор из 7 фольгированных шаров — бежевые шары, серебряные звёзды и сердце, круг Happy Birthday в гелии, готовая фотозона на праздник, доставим по Нячангу в день заказа",1 000 000 донгов,≈ $40 · 3 200 ₽,Бежево-серебряный набор S (7 фольгированных шаров),Beige & silver balloon set S (7 foil balloons),"a beige and silver set of 7 foil balloons — beige orbs, silver stars and heart, a Happy Birthday round in helium, a ready-made photo zone for a celebration, same-day delivery in Nha Trang",Beige and silver balloon set S 7 foil balloons delivery Nha Trang,베이지-실버 풍선 세트 S (호일 풍선 7개),"베이지 풍선, 실버 별과 하트, Happy Birthday 원형으로 구성된 7개의 호일 풍선 베이지-실버 세트 — 파티 포토존을 완성하는 헬륨 풍선, 나트랑 당일 배달",나트랑 베이지-실버 호일 풍선 세트 S 7개 배달
39,25 розово-персиковых роз в белой упаковке,25-rozovo-persikovyh-roz-v-upakovke,img/products/25-rozovo-persikovyh-roz-v-upakovke/1.webp,25 розово-персиковых роз в белой упаковке Нячанг доставка,"нежный букет из 25 розово-персиковых роз в белой упаковке — изысканный подарок на любой повод, доставим по Нячангу в день заказа",500 000 донгов,≈ $20 · 1 600 ₽,25 розово-персиковых роз в белой упаковке,25 pink-peach roses in white wrap,"an elegant bouquet of 25 pink-peach roses in white wrapping — a refined gift for any occasion, same-day delivery in Nha Trang",25 pink-peach roses in white wrap delivery Nha Trang,화이트 포장 핑크피치 장미 25송이,"부드러운 화이트 포장의 핑크피치 장미 25송이 — 어떤 자리에도 어울리는 우아한 선물, 나트랑 당일 배달",나트랑 화이트 포장 핑크피치 장미 25송이 배달
40,Набор шаров М (10 красных сердец),nabor-sharov-m-10-serdec,img/products/nabor-sharov-m-10-serdec/1.webp,Набор шаров М 10 красных сердец Нячанг доставка,"гелиевый набор М из 10 красных фольгированных сердец — яркий романтический сюрприз на праздник, доставим по Нячангу в день заказа",1 500 000 донгов,≈ $60 · 4 800 ₽,Набор шаров М (10 красных сердец),Balloon set M (10 red hearts),"a helium set M of 10 red foil hearts — a bright romantic surprise for a celebration, same-day delivery in Nha Trang",Balloon set M 10 red hearts delivery Nha Trang,풍선 세트 M (빨간 하트 10개),"빨간 호일 하트 10개로 구성된 헬륨 세트 M — 기념일을 위한 화사한 로맨틱 서프라이즈, 나트랑 당일 배달",나트랑 풍선 세트 M 빨간 하트 10개 배달
41,51 насыщенная розовая роза в белой упаковке,51-nasyshchennaya-rozovaya-roza-v-upakovke,img/products/51-nasyshchennaya-rozovaya-roza-v-upakovke/1.webp,51 насыщенная розовая роза в белой упаковке Нячанг доставка,"пышный букет из 51 насыщенной розовой розы в белой упаковке — яркий и эффектный подарок на любой повод, доставим по Нячангу в день заказа",1 000 000 донгов,≈ $40 · 3 200 ₽,51 насыщенная розовая роза в белой упаковке,51 vivid pink roses in white wrap,"a lush bouquet of 51 vivid pink roses in white wrapping — a bright and striking gift for any occasion, same-day delivery in Nha Trang",51 vivid pink roses in white wrap delivery Nha Trang,화이트 포장 진한 핑크 장미 51송이,"화이트 포장의 진한 핑크 장미 51송이 풍성한 꽃다발 — 어떤 자리에도 어울리는 화사하고 강렬한 선물, 나트랑 당일 배달",나트랑 화이트 포장 진한 핑크 장미 51송이 배달
42,Набор шаров S (7 красных сердец) + 25 красных роз,nabor-sharov-s-7-serdec-25-roz,img/products/nabor-sharov-s-7-serdec-25-roz/1.webp,Набор шаров S 7 красных сердец и 25 красных роз Нячанг доставка,"гелиевый набор S из 7 красных фольгированных сердец и 25 красных роз в белой упаковке — романтический комплект с готовой фотозоной, доставим по Нячангу в день заказа",1 500 000 донгов,≈ $60 · 4 800 ₽,Набор шаров S (7 красных сердец) + 25 красных роз,Balloon set S (7 red hearts) + 25 red roses,"a helium set S of 7 red foil hearts and 25 red roses in white wrapping — a romantic combo with a ready-made photo zone, same-day delivery in Nha Trang",Balloon set S 7 red hearts and 25 red roses delivery Nha Trang,풍선 세트 S (빨간 하트 7개) + 빨간 장미 25송이,"7개의 빨간 호일 하트와 화이트 포장의 빨간 장미 25송이로 구성된 헬륨 세트 S — 포토존이 있는 로맨틱 세트, 나트랑 당일 배달",나트랑 풍선 세트 S 빨간 하트 7개와 빨간 장미 25송이 배달
43,51 нежно-розовая роза в белой упаковке с розовой лентой,51-nezhno-rozovaya-roza-rozovaya-lenta,img/products/51-nezhno-rozovaya-roza-rozovaya-lenta/1.webp,51 нежно-розовая роза в белой упаковке с розовой лентой Нячанг доставка,"нежный букет из 51 нежно-розовой розы в белой упаковке с розовой лентой — романтичный и трогательный подарок на любой повод, доставим по Нячангу в день заказа",1 000 000 донгов,≈ $40 · 3 200 ₽,51 нежно-розовая роза в белой упаковке с розовой лентой,51 soft pink roses in white wrap with a pink ribbon,"a tender bouquet of 51 soft pink roses in white wrapping with a pink ribbon — a romantic and touching gift for any occasion, same-day delivery in Nha Trang",51 soft pink roses in white wrap with pink ribbon delivery Nha Trang,핑크 리본 화이트 포장 연핑크 장미 51송이,"핑크 리본을 더한 화이트 포장의 연핑크 장미 51송이 부드러운 꽃다발 — 어떤 자리에도 어울리는 로맨틱하고 감동적인 선물, 나트랑 당일 배달",나트랑 핑크 리본 화이트 포장 연핑크 장미 51송이 배달
