id,date,type,category,keyword_ru,title_ru,slug,photo_query_en,status_ru,status_en,status_ko
1,2026-06-03,article,Повод,цветы на день рождения,Какие цветы подарить на день рождения в Нячанге,kakie-cvety-podarit-na-den-rozhdeniya-v-nyachange,birthday flowers bouquet,done,done,done
2,2026-06-04,article,Повод,букет на день рождения,Идеи букетов на день рождения: гид для туриста в Нячанге,idei-buketov-na-den-rozhdeniya-gid-dlya-turista-v-nyachange,birthday flowers bouquet,todo,todo,todo
3,2026-06-05,article,Повод,цветы на годовщину свадьбы,Какие цветы подарить на годовщину свадьбы в Нячанге,kakie-cvety-podarit-na-godovschinu-svadby-v-nyachange,anniversary roses,done,done,done
4,2026-06-06,article,Повод,букет на годовщину свадьбы,Идеи букетов на годовщину свадьбы: гид для туриста в Нячанге,idei-buketov-na-godovschinu-svadby-gid-dlya-turista-v-nyachange,anniversary roses,todo,todo,todo
5,2026-06-07,article,Повод,цветы на 8 марта,Какие цветы подарить на 8 марта в Нячанге,kakie-cvety-podarit-na-8-marta-v-nyachange,tulips spring,todo,todo,todo
6,2026-06-08,article,Повод,букет на 8 марта,Идеи букетов на 8 марта: гид для туриста в Нячанге,idei-buketov-na-8-marta-gid-dlya-turista-v-nyachange,tulips spring,todo,todo,todo
7,2026-06-09,article,Повод,цветы на день матери,Какие цветы подарить на день матери в Нячанге,kakie-cvety-podarit-na-den-materi-v-nyachange,flowers mother,todo,todo,todo
8,2026-06-10,article,Повод,букет на день матери,Идеи букетов на день матери: гид для туриста в Нячанге,idei-buketov-na-den-materi-gid-dlya-turista-v-nyachange,flowers mother,todo,todo,todo
9,2026-06-11,article,Повод,цветы на свадьбу,Какие цветы подарить на свадьбу в Нячанге,kakie-cvety-podarit-na-svadbu-v-nyachange,wedding flowers,todo,todo,todo
10,2026-06-12,article,Повод,букет на свадьбу,Идеи букетов на свадьбу: гид для туриста в Нячанге,idei-buketov-na-svadbu-gid-dlya-turista-v-nyachange,wedding flowers,todo,todo,todo
11,2026-06-13,article,Повод,цветы на помолвку,Какие цветы подарить на помолвку в Нячанге,kakie-cvety-podarit-na-pomolvku-v-nyachange,engagement flowers,todo,todo,todo
12,2026-06-14,article,Повод,букет на помолвку,Идеи букетов на помолвку: гид для туриста в Нячанге,idei-buketov-na-pomolvku-gid-dlya-turista-v-nyachange,engagement flowers,todo,todo,todo
13,2026-06-15,article,Повод,цветы в знак извинения,Какие цветы подарить в знак извинения в Нячанге,kakie-cvety-podarit-v-znak-izvineniya-v-nyachange,apology roses,todo,todo,todo
14,2026-06-16,article,Повод,букет в знак извинения,Идеи букетов в знак извинения: гид для туриста в Нячанге,idei-buketov-v-znak-izvineniya-gid-dlya-turista-v-nyachange,apology roses,todo,todo,todo
15,2026-06-17,article,Повод,цветы на выписку из роддома,Какие цветы подарить на выписку из роддома в Нячанге,kakie-cvety-podarit-na-vypisku-iz-roddoma-v-nyachange,newborn flowers,todo,todo,todo
16,2026-06-18,article,Повод,букет на выписку из роддома,Идеи букетов на выписку из роддома: гид для туриста в Нячанге,idei-buketov-na-vypisku-iz-roddoma-gid-dlya-turista-v-nyachange,newborn flowers,todo,todo,todo
17,2026-06-19,article,Повод,цветы на первое свидание,Какие цветы подарить на первое свидание в Нячанге,kakie-cvety-podarit-na-pervoe-svidanie-v-nyachange,romantic date flowers,todo,todo,todo
18,2026-06-20,article,Повод,букет на первое свидание,Идеи букетов на первое свидание: гид для туриста в Нячанге,idei-buketov-na-pervoe-svidanie-gid-dlya-turista-v-nyachange,romantic date flowers,todo,todo,todo
19,2026-06-21,article,Повод,цветы для признания в любви,Какие цветы подарить для признания в любви в Нячанге,kakie-cvety-podarit-dlya-priznaniya-v-lyubvi-v-nyachange,red roses love,todo,todo,todo
20,2026-06-22,article,Повод,букет для признания в любви,Идеи букетов для признания в любви: гид для туриста в Нячанге,idei-buketov-dlya-priznaniya-v-lyubvi-gid-dlya-turista-v-nyachang,red roses love,todo,todo,todo
21,2026-06-23,article,Повод,цветы на юбилей,Какие цветы подарить на юбилей в Нячанге,kakie-cvety-podarit-na-yubiley-v-nyachange,celebration bouquet,todo,todo,todo
22,2026-06-24,article,Повод,букет на юбилей,Идеи букетов на юбилей: гид для туриста в Нячанге,idei-buketov-na-yubiley-gid-dlya-turista-v-nyachange,celebration bouquet,todo,todo,todo
23,2026-06-25,article,Повод,цветы на новоселье,Какие цветы подарить на новоселье в Нячанге,kakie-cvety-podarit-na-novosele-v-nyachange,housewarming flowers,todo,todo,todo
24,2026-06-26,article,Повод,букет на новоселье,Идеи букетов на новоселье: гид для туриста в Нячанге,idei-buketov-na-novosele-gid-dlya-turista-v-nyachange,housewarming flowers,todo,todo,todo
25,2026-06-27,article,Повод,цветы для выздоровления,Какие цветы подарить для выздоровления в Нячанге,kakie-cvety-podarit-dlya-vyzdorovleniya-v-nyachange,get well flowers,todo,todo,todo
26,2026-06-28,article,Повод,букет для выздоровления,Идеи букетов для выздоровления: гид для туриста в Нячанге,idei-buketov-dlya-vyzdorovleniya-gid-dlya-turista-v-nyachange,get well flowers,todo,todo,todo
27,2026-06-29,article,Повод,цветы на выпускной,Какие цветы подарить на выпускной в Нячанге,kakie-cvety-podarit-na-vypusknoy-v-nyachange,graduation bouquet,todo,todo,todo
28,2026-06-30,article,Повод,букет на выпускной,Идеи букетов на выпускной: гид для туриста в Нячанге,idei-buketov-na-vypusknoy-gid-dlya-turista-v-nyachange,graduation bouquet,todo,todo,todo
29,2026-07-01,article,Повод,цветы на день учителя,Какие цветы подарить на день учителя в Нячанге,kakie-cvety-podarit-na-den-uchitelya-v-nyachange,teacher flowers,todo,todo,todo
30,2026-07-02,article,Повод,букет на день учителя,Идеи букетов на день учителя: гид для туриста в Нячанге,idei-buketov-na-den-uchitelya-gid-dlya-turista-v-nyachange,teacher flowers,todo,todo,todo
31,2026-07-03,article,Повод,цветы на 14 февраля,Какие цветы подарить на 14 февраля в Нячанге,kakie-cvety-podarit-na-14-fevralya-v-nyachange,valentine roses,todo,todo,todo
32,2026-07-04,article,Повод,букет на 14 февраля,Идеи букетов на 14 февраля: гид для туриста в Нячанге,idei-buketov-na-14-fevralya-gid-dlya-turista-v-nyachange,valentine roses,todo,todo,todo
33,2026-07-05,article,Повод,цветы в честь рождения ребёнка,Какие цветы подарить в честь рождения ребёнка в Нячанге,kakie-cvety-podarit-v-chest-rozhdeniya-rebenka-v-nyachange,baby flowers,todo,todo,todo
34,2026-07-06,article,Повод,букет в честь рождения ребёнка,Идеи букетов в честь рождения ребёнка: гид для туриста в Нячанге,idei-buketov-v-chest-rozhdeniya-rebenka-gid-dlya-turista-v-nyacha,baby flowers,todo,todo,todo
35,2026-07-07,article,Повод,цветы на корпоратив,Какие цветы подарить на корпоратив в Нячанге,kakie-cvety-podarit-na-korporativ-v-nyachange,office flowers,todo,todo,todo
36,2026-07-08,article,Повод,букет на корпоратив,Идеи букетов на корпоратив: гид для туриста в Нячанге,idei-buketov-na-korporativ-gid-dlya-turista-v-nyachange,office flowers,todo,todo,todo
37,2026-07-09,article,Повод,цветы деловому партнёру,Какие цветы подарить деловому партнёру в Нячанге,kakie-cvety-podarit-delovomu-partneru-v-nyachange,elegant business flowers,todo,todo,todo
38,2026-07-10,article,Повод,букет деловому партнёру,Идеи букетов деловому партнёру: гид для туриста в Нячанге,idei-buketov-delovomu-partneru-gid-dlya-turista-v-nyachange,elegant business flowers,todo,todo,todo
39,2026-07-11,article,Повод,цветы просто так,Какие цветы подарить просто так в Нячанге,kakie-cvety-podarit-prosto-tak-v-nyachange,fresh surprise flowers,todo,todo,todo
40,2026-07-12,article,Повод,букет просто так,Идеи букетов просто так: гид для туриста в Нячанге,idei-buketov-prosto-tak-gid-dlya-turista-v-nyachange,fresh surprise flowers,todo,todo,todo
41,2026-07-13,article,Получатель,цветы жене,Какие цветы выбрать жене — гид по букетам в Нячанге,kakie-cvety-vybrat-zhene-gid-po-buketam-v-nyachange,wife,todo,todo,todo
42,2026-07-14,article,Получатель,цветы девушке,Какие цветы выбрать девушке — гид по букетам в Нячанге,kakie-cvety-vybrat-devushke-gid-po-buketam-v-nyachange,girlfriend,todo,todo,todo
43,2026-07-15,article,Получатель,цветы маме,Какие цветы выбрать маме — гид по букетам в Нячанге,kakie-cvety-vybrat-mame-gid-po-buketam-v-nyachange,mom,todo,todo,todo
44,2026-07-16,article,Получатель,цветы подруге,Какие цветы выбрать подруге — гид по букетам в Нячанге,kakie-cvety-vybrat-podruge-gid-po-buketam-v-nyachange,friend,todo,todo,todo
45,2026-07-17,article,Получатель,цветы коллеге,Какие цветы выбрать коллеге — гид по букетам в Нячанге,kakie-cvety-vybrat-kollege-gid-po-buketam-v-nyachange,colleague,todo,todo,todo
46,2026-07-18,article,Получатель,цветы начальнице,Какие цветы выбрать начальнице — гид по букетам в Нячанге,kakie-cvety-vybrat-nachalnice-gid-po-buketam-v-nyachange,boss elegant,todo,todo,todo
47,2026-07-19,article,Получатель,цветы сестре,Какие цветы выбрать сестре — гид по букетам в Нячанге,kakie-cvety-vybrat-sestre-gid-po-buketam-v-nyachange,sister,todo,todo,todo
48,2026-07-20,article,Получатель,цветы бабушке,Какие цветы выбрать бабушке — гид по букетам в Нячанге,kakie-cvety-vybrat-babushke-gid-po-buketam-v-nyachange,grandmother,todo,todo,todo
49,2026-07-21,article,Получатель,цветы любимой,Какие цветы выбрать любимой — гид по букетам в Нячанге,kakie-cvety-vybrat-lyubimoy-gid-po-buketam-v-nyachange,romantic roses,todo,todo,todo
50,2026-07-22,article,Получатель,цветы учительнице,Какие цветы выбрать учительнице — гид по букетам в Нячанге,kakie-cvety-vybrat-uchitelnice-gid-po-buketam-v-nyachange,teacher,todo,todo,todo
51,2026-07-23,article,Цветок,розы нячанг,"Розы в Нячанге: значение, уход и кому дарить",rozy-v-nyachange-znachenie-uhod-i-komu-darit,red roses,todo,todo,todo
52,2026-07-24,article,Цветок,купить розы нячанг,Сколько стоят розы в Нячанге и как заказать доставку,skolko-stoyat-rozy-v-nyachange-i-kak-zakazat-dostavku,red roses,todo,todo,todo
53,2026-07-25,article,Цветок,пионы нячанг,"Пионы в Нячанге: значение, уход и кому дарить",piony-v-nyachange-znachenie-uhod-i-komu-darit,peonies,todo,todo,todo
54,2026-07-26,article,Цветок,купить пионы нячанг,Сколько стоят пионы в Нячанге и как заказать доставку,skolko-stoyat-piony-v-nyachange-i-kak-zakazat-dostavku,peonies,todo,todo,todo
55,2026-07-27,article,Цветок,тюльпаны нячанг,"Тюльпаны в Нячанге: значение, уход и кому дарить",tyulpany-v-nyachange-znachenie-uhod-i-komu-darit,tulips,todo,todo,todo
56,2026-07-28,article,Цветок,купить тюльпаны нячанг,Сколько стоят тюльпаны в Нячанге и как заказать доставку,skolko-stoyat-tyulpany-v-nyachange-i-kak-zakazat-dostavku,tulips,todo,todo,todo
57,2026-07-29,article,Цветок,орхидеи нячанг,"Орхидеи в Нячанге: значение, уход и кому дарить",orhidei-v-nyachange-znachenie-uhod-i-komu-darit,orchids,todo,todo,todo
58,2026-07-30,article,Цветок,купить орхидеи нячанг,Сколько стоят орхидеи в Нячанге и как заказать доставку,skolko-stoyat-orhidei-v-nyachange-i-kak-zakazat-dostavku,orchids,todo,todo,todo
59,2026-07-31,article,Цветок,лилии нячанг,"Лилии в Нячанге: значение, уход и кому дарить",lilii-v-nyachange-znachenie-uhod-i-komu-darit,lilies,todo,todo,todo
60,2026-08-01,article,Цветок,купить лилии нячанг,Сколько стоят лилии в Нячанге и как заказать доставку,skolko-stoyat-lilii-v-nyachange-i-kak-zakazat-dostavku,lilies,todo,todo,todo
61,2026-08-02,article,Цветок,подсолнухи нячанг,"Подсолнухи в Нячанге: значение, уход и кому дарить",podsolnuhi-v-nyachange-znachenie-uhod-i-komu-darit,sunflowers,todo,todo,todo
62,2026-08-03,article,Цветок,купить подсолнухи нячанг,Сколько стоят подсолнухи в Нячанге и как заказать доставку,skolko-stoyat-podsolnuhi-v-nyachange-i-kak-zakazat-dostavku,sunflowers,todo,todo,todo
63,2026-08-04,article,Цветок,хризантемы нячанг,"Хризантемы в Нячанге: значение, уход и кому дарить",hrizantemy-v-nyachange-znachenie-uhod-i-komu-darit,chrysanthemums,todo,todo,todo
64,2026-08-05,article,Цветок,купить хризантемы нячанг,Сколько стоят хризантемы в Нячанге и как заказать доставку,skolko-stoyat-hrizantemy-v-nyachange-i-kak-zakazat-dostavku,chrysanthemums,todo,todo,todo
65,2026-08-06,article,Цветок,герберы нячанг,"Герберы в Нячанге: значение, уход и кому дарить",gerbery-v-nyachange-znachenie-uhod-i-komu-darit,gerbera,todo,todo,todo
66,2026-08-07,article,Цветок,купить герберы нячанг,Сколько стоят герберы в Нячанге и как заказать доставку,skolko-stoyat-gerbery-v-nyachange-i-kak-zakazat-dostavku,gerbera,todo,todo,todo
67,2026-08-08,article,Цветок,гортензии нячанг,"Гортензии в Нячанге: значение, уход и кому дарить",gortenzii-v-nyachange-znachenie-uhod-i-komu-darit,hydrangea,todo,todo,todo
68,2026-08-09,article,Цветок,купить гортензии нячанг,Сколько стоят гортензии в Нячанге и как заказать доставку,skolko-stoyat-gortenzii-v-nyachange-i-kak-zakazat-dostavku,hydrangea,todo,todo,todo
69,2026-08-10,article,Цветок,эустома нячанг,"Эустома в Нячанге: значение, уход и кому дарить",eustoma-v-nyachange-znachenie-uhod-i-komu-darit,eustoma,todo,todo,todo
70,2026-08-11,article,Цветок,купить эустома нячанг,Сколько стоят эустома в Нячанге и как заказать доставку,skolko-stoyat-eustoma-v-nyachange-i-kak-zakazat-dostavku,eustoma,todo,todo,todo
71,2026-08-12,article,Цветок,ромашки нячанг,"Ромашки в Нячанге: значение, уход и кому дарить",romashki-v-nyachange-znachenie-uhod-i-komu-darit,daisies,todo,todo,todo
72,2026-08-13,article,Цветок,купить ромашки нячанг,Сколько стоят ромашки в Нячанге и как заказать доставку,skolko-stoyat-romashki-v-nyachange-i-kak-zakazat-dostavku,daisies,todo,todo,todo
73,2026-08-14,article,Цветок,каллы нячанг,"Каллы в Нячанге: значение, уход и кому дарить",kally-v-nyachange-znachenie-uhod-i-komu-darit,calla lily,todo,todo,todo
74,2026-08-15,article,Цветок,купить каллы нячанг,Сколько стоят каллы в Нячанге и как заказать доставку,skolko-stoyat-kally-v-nyachange-i-kak-zakazat-dostavku,calla lily,todo,todo,todo
75,2026-08-16,article,Гео,доставка цветов в отель нячанг,Доставка цветов в отели Нячанга — как это работает,dostavka-cvetov-v-oteli-nyachanga-kak-eto-rabotaet,hotel flower delivery,todo,todo,todo
76,2026-08-17,article,Гео,доставка цветов камрань,Доставка цветов в Камрань: сроки и зоны,dostavka-cvetov-v-kamran-sroki-i-zony,resort flowers delivery,todo,todo,todo
77,2026-08-18,article,Гео,цветы в номер отеля,Цветы в номер отеля: сюрприз для второй половинки,cvety-v-nomer-otelya-syurpriz-dlya-vtoroy-polovinki,hotel room flowers,todo,todo,todo
78,2026-08-19,article,Гео,романтический сюрприз нячанг,Романтический сюрприз в Нячанге: цветы и шары,romanticheskiy-syurpriz-v-nyachange-cvety-i-shary,romantic surprise balloons,todo,todo,todo
79,2026-08-20,article,Гео,предложение на пляже нячанг,Предложение руки на пляже Нячанга: оформление цветами,predlozhenie-ruki-na-plyazhe-nyachanga-oformlenie-cvetami,beach proposal flowers,todo,todo,todo
80,2026-08-21,article,Гео,цветы аэропорт камрань,Цветы в аэропорт Камрань: встреча с букетом,cvety-v-aeroport-kamran-vstrecha-s-buketom,airport welcome flowers,todo,todo,todo
81,2026-08-22,article,Гео,украшение номера лепестками роз,Украшение номера лепестками роз в Нячанге,ukrashenie-nomera-lepestkami-roz-v-nyachange,rose petals room,todo,todo,todo
82,2026-08-23,article,Гео,доставка цветов круглосуточно нячанг,Доставка цветов 24/7 в Нячанге: ночные заказы,dostavka-cvetov-247-v-nyachange-nochnye-zakazy,night flower delivery,todo,todo,todo
83,2026-08-24,article,Гео,доставка цветов день в день нячанг,Свежие цветы в Нячанге день в день,svezhie-cvety-v-nyachange-den-v-den,same day delivery flowers,todo,todo,todo
84,2026-08-25,article,Гео,купить цветы нячанг турист,Где купить цветы в Нячанге туристу,gde-kupit-cvety-v-nyachange-turistu,tourist buying flowers,todo,todo,todo
85,2026-08-26,article,Гид,как сохранить букет свежим,Как сохранить букет свежим в жарком климате Вьетнама,kak-sohranit-buket-svezhim-v-zharkom-klimate-vetnama,flowers vase care,todo,todo,todo
86,2026-08-27,article,Гид,значение цвета роз,Значение цвета роз: что означает каждый оттенок,znachenie-cveta-roz-chto-oznachaet-kazhdyy-ottenok,colorful roses,todo,todo,todo
87,2026-08-28,article,Гид,язык цветов значение,Язык цветов: что сказать букетом,yazyk-cvetov-chto-skazat-buketom,flower language,todo,todo,todo
88,2026-08-29,article,Гид,сколько роз дарить,Сколько роз дарить: значение количества,skolko-roz-darit-znachenie-kolichestva,roses bunch,todo,todo,todo
89,2026-08-30,article,Гид,заказать цветы whatsapp,Как заказать доставку цветов через WhatsApp,kak-zakazat-dostavku-cvetov-cherez-whatsapp,ordering flowers phone,todo,todo,todo
90,2026-08-31,article,Гид,оплата цветов нячанг,"Оплата цветов рублями, донгами и долларами в Нячанге",oplata-cvetov-rublyami-dongami-i-dollarami-v-nyachange,flowers payment cash,todo,todo,todo
91,2026-09-01,article,Гид,недорогие цветы нячанг,Бюджетные букеты в Нячанге: красиво и недорого,byudzhetnye-bukety-v-nyachange-krasivo-i-nedorogo,budget bouquet,todo,todo,todo
92,2026-09-02,article,Гид,премиум букеты нячанг,Премиум-букеты в Нячанге: люксовые композиции,premium-bukety-v-nyachange-lyuksovye-kompozicii,luxury arrangement,todo,todo,todo
93,2026-09-03,article,Гид,цветы и шары нячанг,Цветы и воздушные шары: идеальный подарок-сюрприз,cvety-i-vozdushnye-shary-idealnyy-podarok-syurpriz,flowers helium balloons,todo,todo,todo
94,2026-09-04,article,Гид,стойкий букет жара,"Как выбрать букет, который не завянет в дороге",kak-vybrat-buket-kotoryy-ne-zavyanet-v-doroge,durable flowers heat,todo,todo,todo
95,2026-09-05,article,Гид,популярные букеты нячанг,Топ-10 популярных букетов в Нячанге,top-10-populyarnyh-buketov-v-nyachange,popular bouquets,todo,todo,todo
96,2026-09-06,article,Гид,сезонные цветы вьетнам,Сезонные цветы во Вьетнаме по месяцам,sezonnye-cvety-vo-vetname-po-mesyacam,seasonal flowers vietnam,todo,todo,todo
97,2026-09-07,article,Культура,традиции цветов вьетнам,Традиции дарения цветов во Вьетнаме,tradicii-dareniya-cvetov-vo-vetname,vietnam flower tradition,todo,todo,todo
98,2026-09-08,article,Культура,цветы для корейцев,Какие цветы любят корейцы: гид для подарка,kakie-cvety-lyubyat-koreycy-gid-dlya-podarka,korean flower gift,todo,todo,todo
99,2026-09-09,article,Культура,цветочный этикет азия,Цветочный этикет для туристов в Азии,cvetochnyy-etiket-dlya-turistov-v-azii,flower etiquette,todo,todo,todo
100,2026-09-10,article,Культура,какие цветы не дарят вьетнам,Какие цветы не дарят во Вьетнаме,kakie-cvety-ne-daryat-vo-vetname,white flowers,todo,todo,todo
101,2026-09-11,article,Культура,корейские праздники цветы,"Корейские праздники и цветы: Соллаль, Чхусок",koreyskie-prazdniki-i-cvety-sollal-chhusok,korean holiday flowers,todo,todo,todo
102,2026-09-12,article,Культура,пепперо день цветы,День 'Пепперо' и другие корейские поводы,den-peppero-i-drugie-koreyskie-povody,pepero day korea,todo,todo,todo
103,2026-09-13,article,Культура,white day подарок,White Day в Корее: что подарить,white-day-v-koree-chto-podarit,white day gift,todo,todo,todo
104,2026-09-14,article,Культура,годовщина 100 дней,Цветы на годовщину 100 дней отношений,cvety-na-godovschinu-100-dney-otnosheniy,couple 100 days flowers,todo,todo,todo
105,2026-09-15,article,Сезон,цветы в январе нячанг,Какие цветы дарить в январе в Нячанге,kakie-cvety-darit-v-yanvare-v-nyachange,seasonal bouquet,todo,todo,todo
