id,date,type,category,keyword_ru,title_ru,slug,photo_query_en,status_ru,status_en,status_ko
106,2026-09-16,article,Сезон,цветы в феврале нячанг,Какие цветы дарить в феврале в Нячанге,kakie-cvety-darit-v-fevrale-v-nyachange,seasonal bouquet,todo,todo,todo
107,2026-09-17,article,Сезон,цветы в марте нячанг,Какие цветы дарить в марте в Нячанге,kakie-cvety-darit-v-marte-v-nyachange,seasonal bouquet,todo,todo,todo
108,2026-09-18,article,Сезон,цветы в апреле нячанг,Какие цветы дарить в апреле в Нячанге,kakie-cvety-darit-v-aprele-v-nyachange,seasonal bouquet,todo,todo,todo
109,2026-09-19,article,Сезон,цветы в мае нячанг,Какие цветы дарить в мае в Нячанге,kakie-cvety-darit-v-mae-v-nyachange,seasonal bouquet,todo,todo,todo
110,2026-09-20,article,Сезон,цветы в июне нячанг,Какие цветы дарить в июне в Нячанге,kakie-cvety-darit-v-iyune-v-nyachange,seasonal bouquet,todo,todo,todo
111,2026-09-21,article,Сезон,цветы в июле нячанг,Какие цветы дарить в июле в Нячанге,kakie-cvety-darit-v-iyule-v-nyachange,seasonal bouquet,todo,todo,todo
112,2026-09-22,article,Сезон,цветы в августе нячанг,Какие цветы дарить в августе в Нячанге,kakie-cvety-darit-v-avguste-v-nyachange,seasonal bouquet,todo,todo,todo
113,2026-09-23,article,Сезон,цветы в сентябре нячанг,Какие цветы дарить в сентябре в Нячанге,kakie-cvety-darit-v-sentyabre-v-nyachange,seasonal bouquet,todo,todo,todo
114,2026-09-24,article,Сезон,цветы в октябре нячанг,Какие цветы дарить в октябре в Нячанге,kakie-cvety-darit-v-oktyabre-v-nyachange,seasonal bouquet,todo,todo,todo
115,2026-09-25,article,Сезон,цветы в ноябре нячанг,Какие цветы дарить в ноябре в Нячанге,kakie-cvety-darit-v-noyabre-v-nyachange,seasonal bouquet,todo,todo,todo
116,2026-09-26,article,Сезон,цветы в декабре нячанг,Какие цветы дарить в декабре в Нячанге,kakie-cvety-darit-v-dekabre-v-nyachange,seasonal bouquet,todo,todo,todo
117,2026-09-27,article,Комбо,букет из роз на день рождения,Букет из роз на день рождения: идеи и доставка в Нячанге,buket-iz-roz-na-den-rozhdeniya-idei-i-dostavka-v-nyachange,roses birthday bouquet,todo,todo,todo
118,2026-09-28,article,Комбо,букет из пионов на день рождения,Букет из пионов на день рождения: идеи и доставка в Нячанге,buket-iz-pionov-na-den-rozhdeniya-idei-i-dostavka-v-nyachange,peonies birthday bouquet,todo,todo,todo
119,2026-09-29,article,Комбо,букет из тюльпанов на день рождения,Букет из тюльпанов на день рождения: идеи и доставка в Нячанге,buket-iz-tyulpanov-na-den-rozhdeniya-idei-i-dostavka-v-nyachange,tulips birthday bouquet,todo,todo,todo
120,2026-09-30,article,Комбо,букет из орхидей на день рождения,Букет из орхидей на день рождения: идеи и доставка в Нячанге,buket-iz-orhidey-na-den-rozhdeniya-idei-i-dostavka-v-nyachange,orchids birthday bouquet,todo,todo,todo
121,2026-10-01,article,Комбо,букет из лилий на день рождения,Букет из лилий на день рождения: идеи и доставка в Нячанге,buket-iz-liliy-na-den-rozhdeniya-idei-i-dostavka-v-nyachange,lilies birthday bouquet,todo,todo,todo
122,2026-10-02,article,Комбо,букет из гербер на день рождения,Букет из гербер на день рождения: идеи и доставка в Нячанге,buket-iz-gerber-na-den-rozhdeniya-idei-i-dostavka-v-nyachange,gerbera birthday bouquet,todo,todo,todo
123,2026-10-03,article,Комбо,букет из хризантем на день рождения,Букет из хризантем на день рождения: идеи и доставка в Нячанге,buket-iz-hrizantem-na-den-rozhdeniya-idei-i-dostavka-v-nyachange,chrysanthemums birthday bouquet,todo,todo,todo
124,2026-10-04,article,Комбо,букет микс на день рождения,Букет микс на день рождения: идеи и доставка в Нячанге,buket-miks-na-den-rozhdeniya-idei-i-dostavka-v-nyachange,mixed bouquet birthday bouquet,todo,todo,todo
125,2026-10-05,article,Комбо,букет из роз на годовщину,Букет из роз на годовщину: идеи и доставка в Нячанге,buket-iz-roz-na-godovschinu-idei-i-dostavka-v-nyachange,roses anniversary bouquet,todo,todo,todo
126,2026-10-06,article,Комбо,букет из пионов на годовщину,Букет из пионов на годовщину: идеи и доставка в Нячанге,buket-iz-pionov-na-godovschinu-idei-i-dostavka-v-nyachange,peonies anniversary bouquet,todo,todo,todo
127,2026-10-07,article,Комбо,букет из тюльпанов на годовщину,Букет из тюльпанов на годовщину: идеи и доставка в Нячанге,buket-iz-tyulpanov-na-godovschinu-idei-i-dostavka-v-nyachange,tulips anniversary bouquet,todo,todo,todo
128,2026-10-08,article,Комбо,букет из орхидей на годовщину,Букет из орхидей на годовщину: идеи и доставка в Нячанге,buket-iz-orhidey-na-godovschinu-idei-i-dostavka-v-nyachange,orchids anniversary bouquet,todo,todo,todo
129,2026-10-09,article,Комбо,букет из лилий на годовщину,Букет из лилий на годовщину: идеи и доставка в Нячанге,buket-iz-liliy-na-godovschinu-idei-i-dostavka-v-nyachange,lilies anniversary bouquet,todo,todo,todo
130,2026-10-10,article,Комбо,букет из гербер на годовщину,Букет из гербер на годовщину: идеи и доставка в Нячанге,buket-iz-gerber-na-godovschinu-idei-i-dostavka-v-nyachange,gerbera anniversary bouquet,todo,todo,todo
131,2026-10-11,article,Комбо,букет из хризантем на годовщину,Букет из хризантем на годовщину: идеи и доставка в Нячанге,buket-iz-hrizantem-na-godovschinu-idei-i-dostavka-v-nyachange,chrysanthemums anniversary bouquet,todo,todo,todo
132,2026-10-12,article,Комбо,букет микс на годовщину,Букет микс на годовщину: идеи и доставка в Нячанге,buket-miks-na-godovschinu-idei-i-dostavka-v-nyachange,mixed bouquet anniversary bouquet,todo,todo,todo
133,2026-10-13,article,Комбо,букет из роз на 8 марта,Букет из роз на 8 марта: идеи и доставка в Нячанге,buket-iz-roz-na-8-marta-idei-i-dostavka-v-nyachange,roses spring bouquet,todo,todo,todo
134,2026-10-14,article,Комбо,букет из пионов на 8 марта,Букет из пионов на 8 марта: идеи и доставка в Нячанге,buket-iz-pionov-na-8-marta-idei-i-dostavka-v-nyachange,peonies spring bouquet,todo,todo,todo
135,2026-10-15,article,Комбо,букет из тюльпанов на 8 марта,Букет из тюльпанов на 8 марта: идеи и доставка в Нячанге,buket-iz-tyulpanov-na-8-marta-idei-i-dostavka-v-nyachange,tulips spring bouquet,todo,todo,todo
136,2026-10-16,article,Комбо,букет из орхидей на 8 марта,Букет из орхидей на 8 марта: идеи и доставка в Нячанге,buket-iz-orhidey-na-8-marta-idei-i-dostavka-v-nyachange,orchids spring bouquet,todo,todo,todo
137,2026-10-17,article,Комбо,букет из лилий на 8 марта,Букет из лилий на 8 марта: идеи и доставка в Нячанге,buket-iz-liliy-na-8-marta-idei-i-dostavka-v-nyachange,lilies spring bouquet,todo,todo,todo
138,2026-10-18,article,Комбо,букет из гербер на 8 марта,Букет из гербер на 8 марта: идеи и доставка в Нячанге,buket-iz-gerber-na-8-marta-idei-i-dostavka-v-nyachange,gerbera spring bouquet,todo,todo,todo
139,2026-10-19,article,Комбо,букет из хризантем на 8 марта,Букет из хризантем на 8 марта: идеи и доставка в Нячанге,buket-iz-hrizantem-na-8-marta-idei-i-dostavka-v-nyachange,chrysanthemums spring bouquet,todo,todo,todo
140,2026-10-20,article,Комбо,букет микс на 8 марта,Букет микс на 8 марта: идеи и доставка в Нячанге,buket-miks-na-8-marta-idei-i-dostavka-v-nyachange,mixed bouquet spring bouquet,todo,todo,todo
141,2026-10-21,article,Комбо,букет из роз на свидание,Букет из роз на свидание: идеи и доставка в Нячанге,buket-iz-roz-na-svidanie-idei-i-dostavka-v-nyachange,roses romantic bouquet,todo,todo,todo
142,2026-10-22,article,Комбо,букет из пионов на свидание,Букет из пионов на свидание: идеи и доставка в Нячанге,buket-iz-pionov-na-svidanie-idei-i-dostavka-v-nyachange,peonies romantic bouquet,todo,todo,todo
143,2026-10-23,article,Комбо,букет из тюльпанов на свидание,Букет из тюльпанов на свидание: идеи и доставка в Нячанге,buket-iz-tyulpanov-na-svidanie-idei-i-dostavka-v-nyachange,tulips romantic bouquet,todo,todo,todo
144,2026-10-24,article,Комбо,букет из орхидей на свидание,Букет из орхидей на свидание: идеи и доставка в Нячанге,buket-iz-orhidey-na-svidanie-idei-i-dostavka-v-nyachange,orchids romantic bouquet,todo,todo,todo
145,2026-10-25,article,Комбо,букет из лилий на свидание,Букет из лилий на свидание: идеи и доставка в Нячанге,buket-iz-liliy-na-svidanie-idei-i-dostavka-v-nyachange,lilies romantic bouquet,todo,todo,todo
146,2026-10-26,article,Комбо,букет из гербер на свидание,Букет из гербер на свидание: идеи и доставка в Нячанге,buket-iz-gerber-na-svidanie-idei-i-dostavka-v-nyachange,gerbera romantic bouquet,todo,todo,todo
147,2026-10-27,article,Комбо,букет из хризантем на свидание,Букет из хризантем на свидание: идеи и доставка в Нячанге,buket-iz-hrizantem-na-svidanie-idei-i-dostavka-v-nyachange,chrysanthemums romantic bouquet,todo,todo,todo
148,2026-10-28,article,Комбо,букет микс на свидание,Букет микс на свидание: идеи и доставка в Нячанге,buket-miks-na-svidanie-idei-i-dostavka-v-nyachange,mixed bouquet romantic bouquet,todo,todo,todo
149,2026-10-29,article,Комбо,букет из роз на извинение,Букет из роз на извинение: идеи и доставка в Нячанге,buket-iz-roz-na-izvinenie-idei-i-dostavka-v-nyachange,roses apology bouquet,todo,todo,todo
150,2026-10-30,article,Комбо,букет из пионов на извинение,Букет из пионов на извинение: идеи и доставка в Нячанге,buket-iz-pionov-na-izvinenie-idei-i-dostavka-v-nyachange,peonies apology bouquet,todo,todo,todo
151,2026-10-31,article,Комбо,букет из тюльпанов на извинение,Букет из тюльпанов на извинение: идеи и доставка в Нячанге,buket-iz-tyulpanov-na-izvinenie-idei-i-dostavka-v-nyachange,tulips apology bouquet,todo,todo,todo
152,2026-11-01,article,Комбо,букет из орхидей на извинение,Букет из орхидей на извинение: идеи и доставка в Нячанге,buket-iz-orhidey-na-izvinenie-idei-i-dostavka-v-nyachange,orchids apology bouquet,todo,todo,todo
153,2026-11-02,article,Комбо,букет из лилий на извинение,Букет из лилий на извинение: идеи и доставка в Нячанге,buket-iz-liliy-na-izvinenie-idei-i-dostavka-v-nyachange,lilies apology bouquet,todo,todo,todo
154,2026-11-03,article,Комбо,букет из гербер на извинение,Букет из гербер на извинение: идеи и доставка в Нячанге,buket-iz-gerber-na-izvinenie-idei-i-dostavka-v-nyachange,gerbera apology bouquet,todo,todo,todo
155,2026-11-04,article,Комбо,букет из хризантем на извинение,Букет из хризантем на извинение: идеи и доставка в Нячанге,buket-iz-hrizantem-na-izvinenie-idei-i-dostavka-v-nyachange,chrysanthemums apology bouquet,todo,todo,todo
156,2026-11-05,article,Комбо,букет микс на извинение,Букет микс на извинение: идеи и доставка в Нячанге,buket-miks-na-izvinenie-idei-i-dostavka-v-nyachange,mixed bouquet apology bouquet,todo,todo,todo
157,2026-11-06,article,Комбо,букет из роз на признание,Букет из роз на признание: идеи и доставка в Нячанге,buket-iz-roz-na-priznanie-idei-i-dostavka-v-nyachange,roses love bouquet,todo,todo,todo
158,2026-11-07,article,Комбо,букет из пионов на признание,Букет из пионов на признание: идеи и доставка в Нячанге,buket-iz-pionov-na-priznanie-idei-i-dostavka-v-nyachange,peonies love bouquet,todo,todo,todo
159,2026-11-08,article,Комбо,букет из тюльпанов на признание,Букет из тюльпанов на признание: идеи и доставка в Нячанге,buket-iz-tyulpanov-na-priznanie-idei-i-dostavka-v-nyachange,tulips love bouquet,todo,todo,todo
160,2026-11-09,article,Комбо,букет из орхидей на признание,Букет из орхидей на признание: идеи и доставка в Нячанге,buket-iz-orhidey-na-priznanie-idei-i-dostavka-v-nyachange,orchids love bouquet,todo,todo,todo
161,2026-11-10,article,Комбо,букет из лилий на признание,Букет из лилий на признание: идеи и доставка в Нячанге,buket-iz-liliy-na-priznanie-idei-i-dostavka-v-nyachange,lilies love bouquet,todo,todo,todo
162,2026-11-11,article,Комбо,букет из гербер на признание,Букет из гербер на признание: идеи и доставка в Нячанге,buket-iz-gerber-na-priznanie-idei-i-dostavka-v-nyachange,gerbera love bouquet,todo,todo,todo
163,2026-11-12,article,Комбо,букет из хризантем на признание,Букет из хризантем на признание: идеи и доставка в Нячанге,buket-iz-hrizantem-na-priznanie-idei-i-dostavka-v-nyachange,chrysanthemums love bouquet,todo,todo,todo
164,2026-11-13,article,Комбо,букет микс на признание,Букет микс на признание: идеи и доставка в Нячанге,buket-miks-na-priznanie-idei-i-dostavka-v-nyachange,mixed bouquet love bouquet,todo,todo,todo
165,2026-11-14,article,Комбо,букет из роз на юбилей,Букет из роз на юбилей: идеи и доставка в Нячанге,buket-iz-roz-na-yubiley-idei-i-dostavka-v-nyachange,roses celebration bouquet,todo,todo,todo
166,2026-11-15,article,Комбо,букет из пионов на юбилей,Букет из пионов на юбилей: идеи и доставка в Нячанге,buket-iz-pionov-na-yubiley-idei-i-dostavka-v-nyachange,peonies celebration bouquet,todo,todo,todo
167,2026-11-16,article,Комбо,букет из тюльпанов на юбилей,Букет из тюльпанов на юбилей: идеи и доставка в Нячанге,buket-iz-tyulpanov-na-yubiley-idei-i-dostavka-v-nyachange,tulips celebration bouquet,todo,todo,todo
168,2026-11-17,article,Комбо,букет из орхидей на юбилей,Букет из орхидей на юбилей: идеи и доставка в Нячанге,buket-iz-orhidey-na-yubiley-idei-i-dostavka-v-nyachange,orchids celebration bouquet,todo,todo,todo
169,2026-11-18,article,Комбо,букет из лилий на юбилей,Букет из лилий на юбилей: идеи и доставка в Нячанге,buket-iz-liliy-na-yubiley-idei-i-dostavka-v-nyachange,lilies celebration bouquet,todo,todo,todo
170,2026-11-19,article,Комбо,букет из гербер на юбилей,Букет из гербер на юбилей: идеи и доставка в Нячанге,buket-iz-gerber-na-yubiley-idei-i-dostavka-v-nyachange,gerbera celebration bouquet,todo,todo,todo
171,2026-11-20,article,Комбо,букет из хризантем на юбилей,Букет из хризантем на юбилей: идеи и доставка в Нячанге,buket-iz-hrizantem-na-yubiley-idei-i-dostavka-v-nyachange,chrysanthemums celebration bouquet,todo,todo,todo
172,2026-11-21,article,Комбо,букет микс на юбилей,Букет микс на юбилей: идеи и доставка в Нячанге,buket-miks-na-yubiley-idei-i-dostavka-v-nyachange,mixed bouquet celebration bouquet,todo,todo,todo
173,2026-11-22,article,Комбо,букет из роз на свадьбу,Букет из роз на свадьбу: идеи и доставка в Нячанге,buket-iz-roz-na-svadbu-idei-i-dostavka-v-nyachange,roses wedding bouquet,todo,todo,todo
174,2026-11-23,article,Комбо,букет из пионов на свадьбу,Букет из пионов на свадьбу: идеи и доставка в Нячанге,buket-iz-pionov-na-svadbu-idei-i-dostavka-v-nyachange,peonies wedding bouquet,todo,todo,todo
175,2026-11-24,article,Комбо,букет из тюльпанов на свадьбу,Букет из тюльпанов на свадьбу: идеи и доставка в Нячанге,buket-iz-tyulpanov-na-svadbu-idei-i-dostavka-v-nyachange,tulips wedding bouquet,todo,todo,todo
176,2026-11-25,article,Комбо,букет из орхидей на свадьбу,Букет из орхидей на свадьбу: идеи и доставка в Нячанге,buket-iz-orhidey-na-svadbu-idei-i-dostavka-v-nyachange,orchids wedding bouquet,todo,todo,todo
177,2026-11-26,article,Комбо,букет из лилий на свадьбу,Букет из лилий на свадьбу: идеи и доставка в Нячанге,buket-iz-liliy-na-svadbu-idei-i-dostavka-v-nyachange,lilies wedding bouquet,todo,todo,todo
178,2026-11-27,article,Комбо,букет из гербер на свадьбу,Букет из гербер на свадьбу: идеи и доставка в Нячанге,buket-iz-gerber-na-svadbu-idei-i-dostavka-v-nyachange,gerbera wedding bouquet,todo,todo,todo
179,2026-11-28,article,Комбо,букет из хризантем на свадьбу,Букет из хризантем на свадьбу: идеи и доставка в Нячанге,buket-iz-hrizantem-na-svadbu-idei-i-dostavka-v-nyachange,chrysanthemums wedding bouquet,todo,todo,todo
180,2026-11-29,article,Комбо,букет микс на свадьбу,Букет микс на свадьбу: идеи и доставка в Нячанге,buket-miks-na-svadbu-idei-i-dostavka-v-nyachange,mixed bouquet wedding bouquet,todo,todo,todo
181,2026-11-30,article,Связка,что подарить жене на день рождения,Что подарить жене на день рождения в Нячанге: цветы и идеи,chto-podarit-zhene-na-den-rozhdeniya-v-nyachange-cvety-i-idei,wife birthday flowers,todo,todo,todo
182,2026-12-01,article,Связка,что подарить жене на годовщину,Что подарить жене на годовщину в Нячанге: цветы и идеи,chto-podarit-zhene-na-godovschinu-v-nyachange-cvety-i-idei,wife anniversary flowers,todo,todo,todo
183,2026-12-02,article,Связка,что подарить жене на 8 марта,Что подарить жене на 8 марта в Нячанге: цветы и идеи,chto-podarit-zhene-na-8-marta-v-nyachange-cvety-i-idei,wife spring flowers,todo,todo,todo
184,2026-12-03,article,Связка,что подарить жене на юбилей,Что подарить жене на юбилей в Нячанге: цветы и идеи,chto-podarit-zhene-na-yubiley-v-nyachange-cvety-i-idei,wife celebration flowers,todo,todo,todo
185,2026-12-04,article,Связка,что подарить жене без повода,Что подарить жене без повода в Нячанге: цветы и идеи,chto-podarit-zhene-bez-povoda-v-nyachange-cvety-i-idei,wife surprise flowers,todo,todo,todo
186,2026-12-05,article,Связка,что подарить девушке на день рождения,Что подарить девушке на день рождения в Нячанге: цветы и идеи,chto-podarit-devushke-na-den-rozhdeniya-v-nyachange-cvety-i-idei,girlfriend birthday flowers,todo,todo,todo
187,2026-12-06,article,Связка,что подарить девушке на годовщину,Что подарить девушке на годовщину в Нячанге: цветы и идеи,chto-podarit-devushke-na-godovschinu-v-nyachange-cvety-i-idei,girlfriend anniversary flowers,todo,todo,todo
188,2026-12-07,article,Связка,что подарить девушке на 8 марта,Что подарить девушке на 8 марта в Нячанге: цветы и идеи,chto-podarit-devushke-na-8-marta-v-nyachange-cvety-i-idei,girlfriend spring flowers,todo,todo,todo
189,2026-12-08,article,Связка,что подарить девушке на юбилей,Что подарить девушке на юбилей в Нячанге: цветы и идеи,chto-podarit-devushke-na-yubiley-v-nyachange-cvety-i-idei,girlfriend celebration flowers,todo,todo,todo
190,2026-12-09,article,Связка,что подарить девушке без повода,Что подарить девушке без повода в Нячанге: цветы и идеи,chto-podarit-devushke-bez-povoda-v-nyachange-cvety-i-idei,girlfriend surprise flowers,todo,todo,todo
191,2026-12-10,article,Связка,что подарить маме на день рождения,Что подарить маме на день рождения в Нячанге: цветы и идеи,chto-podarit-mame-na-den-rozhdeniya-v-nyachange-cvety-i-idei,mom birthday flowers,todo,todo,todo
192,2026-12-11,article,Связка,что подарить маме на годовщину,Что подарить маме на годовщину в Нячанге: цветы и идеи,chto-podarit-mame-na-godovschinu-v-nyachange-cvety-i-idei,mom anniversary flowers,todo,todo,todo
193,2026-12-12,article,Связка,что подарить маме на 8 марта,Что подарить маме на 8 марта в Нячанге: цветы и идеи,chto-podarit-mame-na-8-marta-v-nyachange-cvety-i-idei,mom spring flowers,todo,todo,todo
194,2026-12-13,article,Связка,что подарить маме на юбилей,Что подарить маме на юбилей в Нячанге: цветы и идеи,chto-podarit-mame-na-yubiley-v-nyachange-cvety-i-idei,mom celebration flowers,todo,todo,todo
195,2026-12-14,article,Связка,что подарить маме без повода,Что подарить маме без повода в Нячанге: цветы и идеи,chto-podarit-mame-bez-povoda-v-nyachange-cvety-i-idei,mom surprise flowers,todo,todo,todo
196,2026-12-15,article,Связка,что подарить подруге на день рождения,Что подарить подруге на день рождения в Нячанге: цветы и идеи,chto-podarit-podruge-na-den-rozhdeniya-v-nyachange-cvety-i-idei,friend birthday flowers,todo,todo,todo
197,2026-12-16,article,Связка,что подарить подруге на годовщину,Что подарить подруге на годовщину в Нячанге: цветы и идеи,chto-podarit-podruge-na-godovschinu-v-nyachange-cvety-i-idei,friend anniversary flowers,todo,todo,todo
198,2026-12-17,article,Связка,что подарить подруге на 8 марта,Что подарить подруге на 8 марта в Нячанге: цветы и идеи,chto-podarit-podruge-na-8-marta-v-nyachange-cvety-i-idei,friend spring flowers,todo,todo,todo
