id,date,type,category,keyword_ru,title_ru,slug,photo_query_en,status_ru,status_en,status_ko
308,2027-04-06,article,Гид,25 роз значение,Что означает букет из 25 роз,chto-oznachaet-buket-iz-25-roz,red roses bunch,todo,todo,todo
309,2027-04-07,article,Гид,51 роз значение,Что означает букет из 51 роз,chto-oznachaet-buket-iz-51-roz,red roses bunch,todo,todo,todo
310,2027-04-08,article,Гид,101 роз значение,Что означает букет из 101 роз,chto-oznachaet-buket-iz-101-roz,red roses bunch,todo,todo,todo
311,2027-04-09,article,Культура,цветы корейцу день рождения,Какие цветы подарить корейцу на день рождения,kakie-cvety-podarit-koreycu-na-den-rozhdeniya,korean birthday flowers,todo,todo,todo
312,2027-04-10,article,Культура,корейская свадьба цветы,Цветы для корейской свадьбы: традиции,cvety-dlya-koreyskoy-svadby-tradicii,korean wedding flowers,todo,todo,todo
313,2027-04-11,article,Культура,coming of age day цветы,Coming of Age Day: цветы для корейцев,coming-of-age-day-cvety-dlya-koreycev,korean coming of age roses,todo,todo,todo
314,2027-04-12,article,Культура,чхусок цветы подарок,Чхусок: подарки и цветы,chhusok-podarki-i-cvety,chuseok korean holiday,todo,todo,todo
315,2027-04-13,article,Культура,соллаль цветы,Соллаль (корейский новый год) и цветы,sollal-koreyskiy-novyy-god-i-cvety,seollal korean new year,todo,todo,todo
316,2027-04-14,article,Культура,цветы корейские туристы нячанг,Цветы для корейских туристов в Нячанге,cvety-dlya-koreyskih-turistov-v-nyachange,korean tourists flowers,todo,todo,todo
317,2027-04-15,article,Культура,заказать цветы kakaotalk,Как заказать цветы через KakaoTalk,kak-zakazat-cvety-cherez-kakaotalk,ordering flowers app,todo,todo,todo
318,2027-04-16,article,Культура,розы 100 дней корея,Розы на 100/200/300 дней отношений по-корейски,rozy-na-100200300-dney-otnosheniy-po-koreyski,couple anniversary roses,todo,todo,todo
319,2027-04-17,article,Комбо,букет из подсолнухов на день рождения,Букет из подсолнухов на день рождения: идеи и доставка в Нячанге,buket-iz-podsolnuhov-na-den-rozhdeniya-idei-i-dostavka-v-nyachang,sunflowers birthday,todo,todo,todo
320,2027-04-18,article,Комбо,букет из гортензий на день рождения,Букет из гортензий на день рождения: идеи и доставка в Нячанге,buket-iz-gortenziy-na-den-rozhdeniya-idei-i-dostavka-v-nyachange,hydrangea birthday,todo,todo,todo
321,2027-04-19,article,Комбо,букет из эустомы на день рождения,Букет из эустомы на день рождения: идеи и доставка в Нячанге,buket-iz-eustomy-na-den-rozhdeniya-idei-i-dostavka-v-nyachange,eustoma birthday,todo,todo,todo
322,2027-04-20,article,Комбо,букет из ромашек на день рождения,Букет из ромашек на день рождения: идеи и доставка в Нячанге,buket-iz-romashek-na-den-rozhdeniya-idei-i-dostavka-v-nyachange,daisies birthday,todo,todo,todo
323,2027-04-21,article,Комбо,букет из калл на день рождения,Букет из калл на день рождения: идеи и доставка в Нячанге,buket-iz-kall-na-den-rozhdeniya-idei-i-dostavka-v-nyachange,calla lily birthday,todo,todo,todo
324,2027-04-22,article,Комбо,букет из подсолнухов на годовщину,Букет из подсолнухов на годовщину: идеи и доставка в Нячанге,buket-iz-podsolnuhov-na-godovschinu-idei-i-dostavka-v-nyachange,sunflowers anniversary,todo,todo,todo
325,2027-04-23,article,Комбо,букет из гортензий на годовщину,Букет из гортензий на годовщину: идеи и доставка в Нячанге,buket-iz-gortenziy-na-godovschinu-idei-i-dostavka-v-nyachange,hydrangea anniversary,todo,todo,todo
326,2027-04-24,article,Комбо,букет из эустомы на годовщину,Букет из эустомы на годовщину: идеи и доставка в Нячанге,buket-iz-eustomy-na-godovschinu-idei-i-dostavka-v-nyachange,eustoma anniversary,todo,todo,todo
327,2027-04-25,article,Комбо,букет из ромашек на годовщину,Букет из ромашек на годовщину: идеи и доставка в Нячанге,buket-iz-romashek-na-godovschinu-idei-i-dostavka-v-nyachange,daisies anniversary,todo,todo,todo
328,2027-04-26,article,Комбо,букет из калл на годовщину,Букет из калл на годовщину: идеи и доставка в Нячанге,buket-iz-kall-na-godovschinu-idei-i-dostavka-v-nyachange,calla lily anniversary,todo,todo,todo
329,2027-04-27,article,Комбо,букет из подсолнухов на свидание,Букет из подсолнухов на свидание: идеи и доставка в Нячанге,buket-iz-podsolnuhov-na-svidanie-idei-i-dostavka-v-nyachange,sunflowers romantic,todo,todo,todo
330,2027-04-28,article,Комбо,букет из гортензий на свидание,Букет из гортензий на свидание: идеи и доставка в Нячанге,buket-iz-gortenziy-na-svidanie-idei-i-dostavka-v-nyachange,hydrangea romantic,todo,todo,todo
331,2027-04-29,article,Комбо,букет из эустомы на свидание,Букет из эустомы на свидание: идеи и доставка в Нячанге,buket-iz-eustomy-na-svidanie-idei-i-dostavka-v-nyachange,eustoma romantic,todo,todo,todo
332,2027-04-30,article,Комбо,букет из ромашек на свидание,Букет из ромашек на свидание: идеи и доставка в Нячанге,buket-iz-romashek-na-svidanie-idei-i-dostavka-v-nyachange,daisies romantic,todo,todo,todo
333,2027-05-01,article,Комбо,букет из калл на свидание,Букет из калл на свидание: идеи и доставка в Нячанге,buket-iz-kall-na-svidanie-idei-i-dostavka-v-nyachange,calla lily romantic,todo,todo,todo
334,2027-05-02,article,Комбо,букет из подсолнухов на юбилей,Букет из подсолнухов на юбилей: идеи и доставка в Нячанге,buket-iz-podsolnuhov-na-yubiley-idei-i-dostavka-v-nyachange,sunflowers celebration,todo,todo,todo
335,2027-05-03,article,Комбо,букет из гортензий на юбилей,Букет из гортензий на юбилей: идеи и доставка в Нячанге,buket-iz-gortenziy-na-yubiley-idei-i-dostavka-v-nyachange,hydrangea celebration,todo,todo,todo
336,2027-05-04,article,Комбо,букет из эустомы на юбилей,Букет из эустомы на юбилей: идеи и доставка в Нячанге,buket-iz-eustomy-na-yubiley-idei-i-dostavka-v-nyachange,eustoma celebration,todo,todo,todo
337,2027-05-05,article,Комбо,букет из ромашек на юбилей,Букет из ромашек на юбилей: идеи и доставка в Нячанге,buket-iz-romashek-na-yubiley-idei-i-dostavka-v-nyachange,daisies celebration,todo,todo,todo
338,2027-05-06,article,Комбо,букет из калл на юбилей,Букет из калл на юбилей: идеи и доставка в Нячанге,buket-iz-kall-na-yubiley-idei-i-dostavka-v-nyachange,calla lily celebration,todo,todo,todo
339,2027-05-07,article,Гид,цветы по знаку зодиака,Как выбрать цветы по знаку зодиака,kak-vybrat-cvety-po-znaku-zodiaka,zodiac flowers,todo,todo,todo
340,2027-05-08,article,Гид,цветы по цвету букет,Цветы по цвету: как собрать гармоничный букет,cvety-po-cvetu-kak-sobrat-garmonichnyy-buket,color palette bouquet,todo,todo,todo
341,2027-05-09,article,Гид,альтернатива цветам подарок,Что подарить вместо цветов в Нячанге,chto-podarit-vmesto-cvetov-v-nyachange,gift alternative flowers,todo,todo,todo
342,2027-05-10,article,Гид,что написать в открытке,Открытка к букету: что написать,otkrytka-k-buketu-chto-napisat,gift card note flowers,todo,todo,todo
343,2027-05-11,article,Гид,анонимная доставка цветов,Доставка цветов анонимно в Нячанге,dostavka-cvetov-anonimno-v-nyachange,secret flowers delivery,todo,todo,todo
344,2027-05-12,article,Гид,подписка на цветы,Подписка на цветы: букет каждую неделю,podpiska-na-cvety-buket-kazhduyu-nedelyu,flower subscription weekly,todo,todo,todo
345,2027-05-13,article,Гид,цветы мужчине нячанг,Цветы на работу любимому в Нячанге,cvety-na-rabotu-lyubimomu-v-nyachange,flowers for him men,todo,todo,todo
346,2027-05-14,article,Гид,цветы в горшке подарок,Можно ли дарить цветы в горшке,mozhno-li-darit-cvety-v-gorshke,potted plant gift,todo,todo,todo
347,2027-05-15,article,Гид,стойкие цветы жара,Самые стойкие цветы для жаркого климата,samye-stoykie-cvety-dlya-zharkogo-klimata,heat resistant flowers,todo,todo,todo
348,2027-05-16,article,Гид,свежесть букета проверить,Свежесть букета: как проверить при получении,svezhest-buketa-kak-proverit-pri-poluchenii,fresh flowers check,todo,todo,todo
349,2027-05-17,article,Повод,цветы на новый год нячанг,Цветы на Новый год в Нячанге,cvety-na-novyy-god-v-nyachange,new year flowers,todo,todo,todo
350,2027-05-18,article,Повод,цветы на рождество,Цветы на Рождество для туристов,cvety-na-rozhdestvo-dlya-turistov,christmas flowers,todo,todo,todo
351,2027-05-19,article,Повод,валентинка букет для неё,Букет на день святого Валентина для неё,buket-na-den-svyatogo-valentina-dlya-nee,valentine bouquet her,todo,todo,todo
352,2027-05-20,article,Повод,валентинка букет для него,Букет на день святого Валентина для него,buket-na-den-svyatogo-valentina-dlya-nego,valentine flowers him,todo,todo,todo
353,2027-05-21,article,Повод,цветы 8 марта офис,Цветы на Международный женский день в офис,cvety-na-mezhdunarodnyy-zhenskiy-den-v-ofis,womens day office flowers,todo,todo,todo
354,2027-05-22,article,Повод,цветы маме день рождения,Цветы маме на день рождения: топ идей,cvety-mame-na-den-rozhdeniya-top-idey,mom birthday flowers,todo,todo,todo
355,2027-05-23,article,Повод,свадебная арка цветы,Свадебная арка из живых цветов в Нячанге,svadebnaya-arka-iz-zhivyh-cvetov-v-nyachange,wedding flower arch,todo,todo,todo
356,2027-05-24,article,Повод,бутоньерка жениху,Бутоньерка жениху и гостям,butonerka-zhenihu-i-gostyam,groom boutonniere,todo,todo,todo
357,2027-05-25,article,Повод,лепестки роз брачная ночь,Лепестки роз для брачной ночи,lepestki-roz-dlya-brachnoy-nochi,rose petals romance,todo,todo,todo
358,2027-05-26,article,Повод,цветы на выписку малыша,Цветы на выписку: мальчик или девочка,cvety-na-vypisku-malchik-ili-devochka,newborn welcome flowers,todo,todo,todo
359,2027-05-27,article,Повод,101 роза нячанг,Большой букет 101 роза в Нячанге,bolshoy-buket-101-roza-v-nyachange,101 roses big bouquet,todo,todo,todo
360,2027-05-28,article,Повод,маленький букет подарок,Маленький милый букетик в подарок,malenkiy-milyy-buketik-v-podarok,small cute bouquet,todo,todo,todo
361,2027-05-29,article,Повод,цветы и торт нячанг,Цветы и торт: двойной сюрприз в Нячанге,cvety-i-tort-dvoynoy-syurpriz-v-nyachange,flowers and cake,todo,todo,todo
362,2027-05-30,article,Повод,доставка цветов на виллу,Доставка цветов на виллу в Нячанге,dostavka-cvetov-na-villu-v-nyachange,villa flowers delivery,todo,todo,todo
363,2027-05-31,article,Повод,годовщина 1 год цветы,Цветы для годовщины 1 год (бумажная свадьба),cvety-dlya-godovschiny-1-god-bumazhnaya-svadba,first anniversary flowers,todo,todo,todo
364,2027-06-01,article,Повод,серебряная свадьба цветы,Цветы на серебряную свадьбу 25 лет,cvety-na-serebryanuyu-svadbu-25-let,silver anniversary flowers,todo,todo,todo
365,2027-06-02,article,Повод,букет на защиту диплома,Букет преподавателю на защиту диплома,buket-prepodavatelyu-na-zaschitu-diploma,graduation defense flowers,todo,todo,todo
