id,date,type,category,keyword_ru,title_ru,slug,photo_query_en,status_ru,status_en,status_ko
199,2026-12-18,article,Связка,что подарить подруге на юбилей,Что подарить подруге на юбилей в Нячанге: цветы и идеи,chto-podarit-podruge-na-yubiley-v-nyachange-cvety-i-idei,friend celebration flowers,todo,todo,todo
200,2026-12-19,article,Связка,что подарить подруге без повода,Что подарить подруге без повода в Нячанге: цветы и идеи,chto-podarit-podruge-bez-povoda-v-nyachange-cvety-i-idei,friend surprise flowers,todo,todo,todo
201,2026-12-20,article,Связка,что подарить коллеге на день рождения,Что подарить коллеге на день рождения в Нячанге: цветы и идеи,chto-podarit-kollege-na-den-rozhdeniya-v-nyachange-cvety-i-idei,colleague birthday flowers,todo,todo,todo
202,2026-12-21,article,Связка,что подарить коллеге на годовщину,Что подарить коллеге на годовщину в Нячанге: цветы и идеи,chto-podarit-kollege-na-godovschinu-v-nyachange-cvety-i-idei,colleague anniversary flowers,todo,todo,todo
203,2026-12-22,article,Связка,что подарить коллеге на 8 марта,Что подарить коллеге на 8 марта в Нячанге: цветы и идеи,chto-podarit-kollege-na-8-marta-v-nyachange-cvety-i-idei,colleague spring flowers,todo,todo,todo
204,2026-12-23,article,Связка,что подарить коллеге на юбилей,Что подарить коллеге на юбилей в Нячанге: цветы и идеи,chto-podarit-kollege-na-yubiley-v-nyachange-cvety-i-idei,colleague celebration flowers,todo,todo,todo
205,2026-12-24,article,Связка,что подарить коллеге без повода,Что подарить коллеге без повода в Нячанге: цветы и идеи,chto-podarit-kollege-bez-povoda-v-nyachange-cvety-i-idei,colleague surprise flowers,todo,todo,todo
206,2026-12-25,article,Связка,что подарить сестре на день рождения,Что подарить сестре на день рождения в Нячанге: цветы и идеи,chto-podarit-sestre-na-den-rozhdeniya-v-nyachange-cvety-i-idei,sister birthday flowers,todo,todo,todo
207,2026-12-26,article,Связка,что подарить сестре на годовщину,Что подарить сестре на годовщину в Нячанге: цветы и идеи,chto-podarit-sestre-na-godovschinu-v-nyachange-cvety-i-idei,sister anniversary flowers,todo,todo,todo
208,2026-12-27,article,Связка,что подарить сестре на 8 марта,Что подарить сестре на 8 марта в Нячанге: цветы и идеи,chto-podarit-sestre-na-8-marta-v-nyachange-cvety-i-idei,sister spring flowers,todo,todo,todo
209,2026-12-28,article,Связка,что подарить сестре на юбилей,Что подарить сестре на юбилей в Нячанге: цветы и идеи,chto-podarit-sestre-na-yubiley-v-nyachange-cvety-i-idei,sister celebration flowers,todo,todo,todo
210,2026-12-29,article,Связка,что подарить сестре без повода,Что подарить сестре без повода в Нячанге: цветы и идеи,chto-podarit-sestre-bez-povoda-v-nyachange-cvety-i-idei,sister surprise flowers,todo,todo,todo
211,2026-12-30,article,Связка,что подарить любимой на день рождения,Что подарить любимой на день рождения в Нячанге: цветы и идеи,chto-podarit-lyubimoy-na-den-rozhdeniya-v-nyachange-cvety-i-idei,beloved birthday flowers,todo,todo,todo
212,2026-12-31,article,Связка,что подарить любимой на годовщину,Что подарить любимой на годовщину в Нячанге: цветы и идеи,chto-podarit-lyubimoy-na-godovschinu-v-nyachange-cvety-i-idei,beloved anniversary flowers,todo,todo,todo
213,2027-01-01,article,Связка,что подарить любимой на 8 марта,Что подарить любимой на 8 марта в Нячанге: цветы и идеи,chto-podarit-lyubimoy-na-8-marta-v-nyachange-cvety-i-idei,beloved spring flowers,todo,todo,todo
214,2027-01-02,article,Связка,что подарить любимой на юбилей,Что подарить любимой на юбилей в Нячанге: цветы и идеи,chto-podarit-lyubimoy-na-yubiley-v-nyachange-cvety-i-idei,beloved celebration flowers,todo,todo,todo
215,2027-01-03,article,Связка,что подарить любимой без повода,Что подарить любимой без повода в Нячанге: цветы и идеи,chto-podarit-lyubimoy-bez-povoda-v-nyachange-cvety-i-idei,beloved surprise flowers,todo,todo,todo
216,2027-01-04,article,Отель,доставка цветов Muong Thanh,Доставка цветов в отель Muong Thanh (Нячанг / Камрань),dostavka-cvetov-v-otel-muong-thanh-nyachang-kamran,hotel flowers luxury,todo,todo,todo
217,2027-01-05,article,Отель,доставка цветов Sheraton,Доставка цветов в отель Sheraton (Нячанг / Камрань),dostavka-cvetov-v-otel-sheraton-nyachang-kamran,hotel flowers luxury,todo,todo,todo
218,2027-01-06,article,Отель,доставка цветов InterContinental,Доставка цветов в отель InterContinental (Нячанг / Камрань),dostavka-cvetov-v-otel-intercontinental-nyachang-kamran,hotel flowers luxury,todo,todo,todo
219,2027-01-07,article,Отель,доставка цветов Novotel,Доставка цветов в отель Novotel (Нячанг / Камрань),dostavka-cvetov-v-otel-novotel-nyachang-kamran,hotel flowers luxury,todo,todo,todo
220,2027-01-08,article,Отель,доставка цветов Mercure,Доставка цветов в отель Mercure (Нячанг / Камрань),dostavka-cvetov-v-otel-mercure-nyachang-kamran,hotel flowers luxury,todo,todo,todo
221,2027-01-09,article,Отель,доставка цветов Sunrise,Доставка цветов в отель Sunrise (Нячанг / Камрань),dostavka-cvetov-v-otel-sunrise-nyachang-kamran,hotel flowers luxury,todo,todo,todo
222,2027-01-10,article,Отель,доставка цветов Havana,Доставка цветов в отель Havana (Нячанг / Камрань),dostavka-cvetov-v-otel-havana-nyachang-kamran,hotel flowers luxury,todo,todo,todo
223,2027-01-11,article,Отель,доставка цветов Diamond Bay,Доставка цветов в отель Diamond Bay (Нячанг / Камрань),dostavka-cvetov-v-otel-diamond-bay-nyachang-kamran,hotel flowers luxury,todo,todo,todo
224,2027-01-12,article,Отель,доставка цветов Liberty Central,Доставка цветов в отель Liberty Central (Нячанг / Камрань),dostavka-cvetov-v-otel-liberty-central-nyachang-kamran,hotel flowers luxury,todo,todo,todo
225,2027-01-13,article,Отель,доставка цветов Premier Havana,Доставка цветов в отель Premier Havana (Нячанг / Камрань),dostavka-cvetov-v-otel-premier-havana-nyachang-kamran,hotel flowers luxury,todo,todo,todo
226,2027-01-14,article,Отель,доставка цветов Galina,Доставка цветов в отель Galina (Нячанг / Камрань),dostavka-cvetov-v-otel-galina-nyachang-kamran,hotel flowers luxury,todo,todo,todo
227,2027-01-15,article,Отель,доставка цветов Ariyana,Доставка цветов в отель Ariyana (Нячанг / Камрань),dostavka-cvetov-v-otel-ariyana-nyachang-kamran,hotel flowers luxury,todo,todo,todo
228,2027-01-16,article,Отель,доставка цветов Potique,Доставка цветов в отель Potique (Нячанг / Камрань),dostavka-cvetov-v-otel-potique-nyachang-kamran,hotel flowers luxury,todo,todo,todo
229,2027-01-17,article,Отель,доставка цветов Selectum Noa,Доставка цветов в отель Selectum Noa (Нячанг / Камрань),dostavka-cvetov-v-otel-selectum-noa-nyachang-kamran,hotel flowers luxury,todo,todo,todo
230,2027-01-18,article,Отель,доставка цветов Movenpick,Доставка цветов в отель Movenpick (Нячанг / Камрань),dostavka-cvetov-v-otel-movenpick-nyachang-kamran,hotel flowers luxury,todo,todo,todo
231,2027-01-19,article,Отель,доставка цветов Radisson Blu,Доставка цветов в отель Radisson Blu (Нячанг / Камрань),dostavka-cvetov-v-otel-radisson-blu-nyachang-kamran,hotel flowers luxury,todo,todo,todo
232,2027-01-20,article,Отель,доставка цветов Alma Resort,Доставка цветов в отель Alma Resort (Нячанг / Камрань),dostavka-cvetov-v-otel-alma-resort-nyachang-kamran,hotel flowers luxury,todo,todo,todo
233,2027-01-21,article,Отель,доставка цветов The Anam,Доставка цветов в отель The Anam (Нячанг / Камрань),dostavka-cvetov-v-otel-the-anam-nyachang-kamran,hotel flowers luxury,todo,todo,todo
234,2027-01-22,article,Отель,доставка цветов Fusion Resort,Доставка цветов в отель Fusion Resort (Нячанг / Камрань),dostavka-cvetov-v-otel-fusion-resort-nyachang-kamran,hotel flowers luxury,todo,todo,todo
235,2027-01-23,article,Отель,доставка цветов Duyen Ha,Доставка цветов в отель Duyen Ha (Нячанг / Камрань),dostavka-cvetov-v-otel-duyen-ha-nyachang-kamran,hotel flowers luxury,todo,todo,todo
236,2027-01-24,article,Связка,розы жене,Розы жене: когда уместно и как заказать в Нячанге,rozy-zhene-kogda-umestno-i-kak-zakazat-v-nyachange,roses for wife,todo,todo,todo
237,2027-01-25,article,Связка,розы маме,Розы маме: когда уместно и как заказать в Нячанге,rozy-mame-kogda-umestno-i-kak-zakazat-v-nyachange,roses for mom,todo,todo,todo
238,2027-01-26,article,Связка,розы девушке,Розы девушке: когда уместно и как заказать в Нячанге,rozy-devushke-kogda-umestno-i-kak-zakazat-v-nyachange,roses for girlfriend,todo,todo,todo
239,2027-01-27,article,Связка,розы коллеге,Розы коллеге: когда уместно и как заказать в Нячанге,rozy-kollege-kogda-umestno-i-kak-zakazat-v-nyachange,roses for colleague,todo,todo,todo
240,2027-01-28,article,Связка,пионы жене,Пионы жене: когда уместно и как заказать в Нячанге,piony-zhene-kogda-umestno-i-kak-zakazat-v-nyachange,peonies for wife,todo,todo,todo
241,2027-01-29,article,Связка,пионы маме,Пионы маме: когда уместно и как заказать в Нячанге,piony-mame-kogda-umestno-i-kak-zakazat-v-nyachange,peonies for mom,todo,todo,todo
242,2027-01-30,article,Связка,пионы девушке,Пионы девушке: когда уместно и как заказать в Нячанге,piony-devushke-kogda-umestno-i-kak-zakazat-v-nyachange,peonies for girlfriend,todo,todo,todo
243,2027-01-31,article,Связка,пионы коллеге,Пионы коллеге: когда уместно и как заказать в Нячанге,piony-kollege-kogda-umestno-i-kak-zakazat-v-nyachange,peonies for colleague,todo,todo,todo
244,2027-02-01,article,Связка,тюльпаны жене,Тюльпаны жене: когда уместно и как заказать в Нячанге,tyulpany-zhene-kogda-umestno-i-kak-zakazat-v-nyachange,tulips for wife,todo,todo,todo
245,2027-02-02,article,Связка,тюльпаны маме,Тюльпаны маме: когда уместно и как заказать в Нячанге,tyulpany-mame-kogda-umestno-i-kak-zakazat-v-nyachange,tulips for mom,todo,todo,todo
246,2027-02-03,article,Связка,тюльпаны девушке,Тюльпаны девушке: когда уместно и как заказать в Нячанге,tyulpany-devushke-kogda-umestno-i-kak-zakazat-v-nyachange,tulips for girlfriend,todo,todo,todo
247,2027-02-04,article,Связка,тюльпаны коллеге,Тюльпаны коллеге: когда уместно и как заказать в Нячанге,tyulpany-kollege-kogda-umestno-i-kak-zakazat-v-nyachange,tulips for colleague,todo,todo,todo
248,2027-02-05,article,Связка,орхидеи жене,Орхидеи жене: когда уместно и как заказать в Нячанге,orhidei-zhene-kogda-umestno-i-kak-zakazat-v-nyachange,orchids for wife,todo,todo,todo
249,2027-02-06,article,Связка,орхидеи маме,Орхидеи маме: когда уместно и как заказать в Нячанге,orhidei-mame-kogda-umestno-i-kak-zakazat-v-nyachange,orchids for mom,todo,todo,todo
250,2027-02-07,article,Связка,орхидеи девушке,Орхидеи девушке: когда уместно и как заказать в Нячанге,orhidei-devushke-kogda-umestno-i-kak-zakazat-v-nyachange,orchids for girlfriend,todo,todo,todo
251,2027-02-08,article,Связка,орхидеи коллеге,Орхидеи коллеге: когда уместно и как заказать в Нячанге,orhidei-kollege-kogda-umestno-i-kak-zakazat-v-nyachange,orchids for colleague,todo,todo,todo
252,2027-02-09,article,Связка,лилии жене,Лилии жене: когда уместно и как заказать в Нячанге,lilii-zhene-kogda-umestno-i-kak-zakazat-v-nyachange,lilies for wife,todo,todo,todo
253,2027-02-10,article,Связка,лилии маме,Лилии маме: когда уместно и как заказать в Нячанге,lilii-mame-kogda-umestno-i-kak-zakazat-v-nyachange,lilies for mom,todo,todo,todo
254,2027-02-11,article,Связка,лилии девушке,Лилии девушке: когда уместно и как заказать в Нячанге,lilii-devushke-kogda-umestno-i-kak-zakazat-v-nyachange,lilies for girlfriend,todo,todo,todo
255,2027-02-12,article,Связка,лилии коллеге,Лилии коллеге: когда уместно и как заказать в Нячанге,lilii-kollege-kogda-umestno-i-kak-zakazat-v-nyachange,lilies for colleague,todo,todo,todo
256,2027-02-13,article,Связка,подсолнухи жене,Подсолнухи жене: когда уместно и как заказать в Нячанге,podsolnuhi-zhene-kogda-umestno-i-kak-zakazat-v-nyachange,sunflowers for wife,todo,todo,todo
257,2027-02-14,article,Связка,подсолнухи маме,Подсолнухи маме: когда уместно и как заказать в Нячанге,podsolnuhi-mame-kogda-umestno-i-kak-zakazat-v-nyachange,sunflowers for mom,todo,todo,todo
258,2027-02-15,article,Связка,подсолнухи девушке,Подсолнухи девушке: когда уместно и как заказать в Нячанге,podsolnuhi-devushke-kogda-umestno-i-kak-zakazat-v-nyachange,sunflowers for girlfriend,todo,todo,todo
259,2027-02-16,article,Связка,подсолнухи коллеге,Подсолнухи коллеге: когда уместно и как заказать в Нячанге,podsolnuhi-kollege-kogda-umestno-i-kak-zakazat-v-nyachange,sunflowers for colleague,todo,todo,todo
260,2027-02-17,article,Гид,сюрприз в отеле нячанг,Как сделать сюрприз туристу в отеле Нячанга,kak-sdelat-syurpriz-turistu-v-otele-nyachanga,hotel surprise,todo,todo,todo
261,2027-02-18,article,Гид,романтический ужин нячанг,Романтический ужин в Нячанге с цветами,romanticheskiy-uzhin-v-nyachange-s-cvetami,romantic dinner flowers,todo,todo,todo
262,2027-02-19,article,Гид,цветы на расстоянии,Цветы любимым на расстоянии в Нячанге,cvety-lyubimym-na-rasstoyanii-v-nyachange,long distance flowers,todo,todo,todo
263,2027-02-20,article,Гид,корзина цветов или букет,Корзина цветов vs букет: что выбрать,korzina-cvetov-vs-buket-chto-vybrat,flower basket,todo,todo,todo
264,2027-02-21,article,Гид,монобукет нячанг,Монобукет: стильный минимализм,monobuket-stilnyy-minimalizm,mono bouquet,todo,todo,todo
265,2027-02-22,article,Гид,авторский букет нячанг,Авторские букеты ручной работы в Нячанге,avtorskie-bukety-ruchnoy-raboty-v-nyachange,handmade bouquet,todo,todo,todo
266,2027-02-23,article,Гид,цветы в коробке нячанг,Цветы в шляпной коробке в Нячанге,cvety-v-shlyapnoy-korobke-v-nyachange,flowers in box,todo,todo,todo
267,2027-02-24,article,Гид,сухоцветы стабилизированные,Сухоцветы и стабилизированные цветы,suhocvety-i-stabilizirovannye-cvety,dried flowers,todo,todo,todo
268,2027-02-25,article,Гид,свадебный букет невесты,Свадебный букет невесты в Нячанге,svadebnyy-buket-nevesty-v-nyachange,bridal bouquet,todo,todo,todo
269,2027-02-26,article,Гид,цветы для фотосессии,Цветы для фотосессии в Нячанге,cvety-dlya-fotosessii-v-nyachange,flowers photoshoot,todo,todo,todo
270,2027-02-27,article,Гид,свадьба на пляже цветы,Композиции для свадьбы на пляже Нячанга,kompozicii-dlya-svadby-na-plyazhe-nyachanga,beach wedding flowers,todo,todo,todo
271,2027-02-28,article,Гид,букет комплимент,Букет-комплимент: маленький знак внимания,buket-kompliment-malenkiy-znak-vnimaniya,small bouquet,todo,todo,todo
272,2027-03-01,article,Гид,день влюблённых цветы заказ,Цветы на день влюблённых заранее,cvety-na-den-vlyublennyh-zaranee,valentine flowers,todo,todo,todo
273,2027-03-02,article,Гид,ошибки выбор букета,Топ ошибок при выборе букета,top-oshibok-pri-vybore-buketa,choosing bouquet,todo,todo,todo
274,2027-03-03,article,Гид,удивить корейскую девушку,Как удивить корейскую девушку цветами,kak-udivit-koreyskuyu-devushku-cvetami,korean girl flowers,todo,todo,todo
275,2027-03-04,article,Гид,цветы и сладости подарок,Цветы и сладости: комбо-подарки в Нячанге,cvety-i-sladosti-kombo-podarki-v-nyachange,flowers chocolate,todo,todo,todo
276,2027-03-05,article,Гид,цветы в офис нячанг,Букет на рабочий стол: цветы в офис Нячанга,buket-na-rabochiy-stol-cvety-v-ofis-nyachanga,office desk flowers,todo,todo,todo
277,2027-03-06,article,Гид,цветы на крестины,Цветы на крестины и для малыша,cvety-na-krestiny-i-dlya-malysha,baby christening flowers,todo,todo,todo
278,2027-03-07,article,Цена,цена букета роз нячанг,Сколько стоит букет роз в Нячанге,skolko-stoit-buket-roz-v-nyachange,roses price,todo,todo,todo
279,2027-03-08,article,Цена,цены доставки цветов нячанг,Доставка цветов в Нячанге: цены и тарифы,dostavka-cvetov-v-nyachange-ceny-i-tarify,delivery price flowers,todo,todo,todo
280,2027-03-09,article,Цена,дешёвые цветы нячанг,Дешёвые цветы в Нячанге без потери качества,deshevye-cvety-v-nyachange-bez-poteri-kachestva,affordable flowers,todo,todo,todo
281,2027-03-10,article,Цена,подарок до 1000 рублей цветы,Подарок до 1000 рублей: цветы в Нячанге,podarok-do-1000-rubley-cvety-v-nyachange,budget gift flowers,todo,todo,todo
282,2027-03-11,article,Шары,гелиевые шары нячанг,Гелиевые шары в Нячанге: доставка и оформление,gelievye-shary-v-nyachange-dostavka-i-oformlenie,helium balloons party,todo,todo,todo
283,2027-03-12,article,Шары,шары на день рождения нячанг,Шары на день рождения в Нячанге,shary-na-den-rozhdeniya-v-nyachange,birthday balloons,todo,todo,todo
284,2027-03-13,article,Шары,фотозона из шаров,Фотозона из шаров для праздника,fotozona-iz-sharov-dlya-prazdnika,balloon photo arch,todo,todo,todo
285,2027-03-14,article,Шары,шары цифры юбилей,Шары-цифры на юбилей,shary-cifry-na-yubiley,number balloons,todo,todo,todo
286,2027-03-15,article,Шары,букет из шаров,Букет из шаров: альтернатива цветам,buket-iz-sharov-alternativa-cvetam,balloon bouquet,todo,todo,todo
287,2027-03-16,article,Шары,шары в отель нячанг,Шары с гелием в номер отеля Нячанга,shary-s-geliem-v-nomer-otelya-nyachanga,balloons hotel room,todo,todo,todo
288,2027-03-17,article,Шары,шары на годовщину,Сюрприз с шарами на годовщину,syurpriz-s-sharami-na-godovschinu,anniversary balloons,todo,todo,todo
289,2027-03-18,article,Шары,шары и цветы нячанг,Шары и цветы вместе: комбо-подарок,shary-i-cvety-vmeste-kombo-podarok,balloons and flowers,todo,todo,todo
290,2027-03-19,article,Шары,шары гендер пати,Шары для гендер-пати в Нячанге,shary-dlya-gender-pati-v-nyachange,gender reveal balloons,todo,todo,todo
291,2027-03-20,article,Шары,светящиеся шары led,Светящиеся шары LED в Нячанге,svetyaschiesya-shary-led-v-nyachange,led balloons night,todo,todo,todo
292,2027-03-21,article,Уход,уход за розами,Как ухаживать за розами в жару Нячанга,kak-uhazhivat-za-rozami-v-zharu-nyachanga,roses care vase,todo,todo,todo
293,2027-03-22,article,Уход,уход за пионами,Как ухаживать за пионами в жару Нячанга,kak-uhazhivat-za-pionami-v-zharu-nyachanga,peonies care,todo,todo,todo
294,2027-03-23,article,Уход,уход за тюльпанами,Как ухаживать за тюльпанами в жару Нячанга,kak-uhazhivat-za-tyulpanami-v-zharu-nyachanga,tulips care,todo,todo,todo
295,2027-03-24,article,Уход,уход за орхидеями,Как ухаживать за орхидеями в жару Нячанга,kak-uhazhivat-za-orhideyami-v-zharu-nyachanga,orchids care,todo,todo,todo
296,2027-03-25,article,Уход,уход за лилиями,Как ухаживать за лилиями в жару Нячанга,kak-uhazhivat-za-liliyami-v-zharu-nyachanga,lilies care,todo,todo,todo
297,2027-03-26,article,Уход,уход за гортензиями,Как ухаживать за гортензиями в жару Нячанга,kak-uhazhivat-za-gortenziyami-v-zharu-nyachanga,hydrangea care,todo,todo,todo
298,2027-03-27,article,Уход,уход за хризантемами,Как ухаживать за хризантемами в жару Нячанга,kak-uhazhivat-za-hrizantemami-v-zharu-nyachanga,chrysanthemums care,todo,todo,todo
299,2027-03-28,article,Уход,уход за герберами,Как ухаживать за герберами в жару Нячанга,kak-uhazhivat-za-gerberami-v-zharu-nyachanga,gerbera care,todo,todo,todo
300,2027-03-29,article,Гид,1 роз значение,Что означает букет из 1 роз,chto-oznachaet-buket-iz-1-roz,red roses bunch,todo,todo,todo
301,2027-03-30,article,Гид,3 роз значение,Что означает букет из 3 роз,chto-oznachaet-buket-iz-3-roz,red roses bunch,todo,todo,todo
302,2027-03-31,article,Гид,5 роз значение,Что означает букет из 5 роз,chto-oznachaet-buket-iz-5-roz,red roses bunch,todo,todo,todo
303,2027-04-01,article,Гид,7 роз значение,Что означает букет из 7 роз,chto-oznachaet-buket-iz-7-roz,red roses bunch,todo,todo,todo
304,2027-04-02,article,Гид,9 роз значение,Что означает букет из 9 роз,chto-oznachaet-buket-iz-9-roz,red roses bunch,todo,todo,todo
305,2027-04-03,article,Гид,11 роз значение,Что означает букет из 11 роз,chto-oznachaet-buket-iz-11-roz,red roses bunch,todo,todo,todo
306,2027-04-04,article,Гид,15 роз значение,Что означает букет из 15 роз,chto-oznachaet-buket-iz-15-roz,red roses bunch,todo,todo,todo
307,2027-04-05,article,Гид,21 роз значение,Что означает букет из 21 роз,chto-oznachaet-buket-iz-21-roz,red roses bunch,todo,todo,todo
